,Unnamed: 0,date,contents,city,city_in_disaster,target
478,145,2020-08-04T19:35:11.000Z,can’t find my car not gnna say what kind cuz ugly but if you see a car in east boston that looks like it misses its mommy call me,boston,0,0
479,210,2020-08-03T15:53:07.000Z,"#EkBharatEkatmaBharat On 5th whole nation to celebrate the J&K integration into Bharat:Black Day call giver be prosecuted for their Big Scams,Loot Scoots & Corruption 
@DrMohanBhagwat
 @narendramodi
 @AmitShah
 @DrJitendraSingh
 @DostKhan_Jammu
 @BJP4India",boston,0,0
480,211,2020-08-04T20:47:32.000Z,this wind is horrible I’m too petite and fertile to handle it,boston,0,0
481,212,2020-08-04T17:18:27.000Z,my boss asked me if I have candles in case the power goes out during the storm lol if only he knew,boston,0,0
482,213,2020-08-04T04:36:22.000Z,"Thank you Plymouth School Committee members for taking the time and making the hard decisions. While I am hesitant to teach in pandemic times, I appreciate the hard work that you all have done. 
@PlymouthSch",boston,0,0
483,214,2020-08-04T21:12:54.000Z,Prayers out for everyone affected by the explosion in Beirut ,boston,0,1
484,215,2020-08-04T18:47:52.000Z,My thoughts are with the people of Lebanon.,boston,0,0
485,216,2020-08-04T19:55:02.000Z,chelsea really need to fix that one spot where it’s just straight potholes nbs,boston,0,0
486,217,2020-08-04T17:30:28.000Z,I’m convinced everyone today only has one brain cell working today,boston,0,0
487,218,2020-08-03T23:46:56.000Z,Banning parties on and off campus is like banning the use of deck chairs on the Titanic. Campuses should be closed until this country can get a handle on a national emergency,boston,0,0
488,219,2020-08-04T18:11:41.000Z,Gonna be a Tuesday BOOZEday am I riggggghht,boston,0,0
489,220,2020-08-04T19:47:44.000Z,s/o twitter bringing back the lil vibration when you like shit,boston,0,0
490,221,2020-08-03T19:00:49.000Z,Getting put down ,boston,0,0
491,222,2020-08-04T23:39:20.000Z,There’s always $$$ to be made,boston,0,0
492,223,2020-08-04T15:02:16.000Z,Gentle reminder that hard work is not the answer to poverty. This mindset is couched in the idea that poverty is laziness which is both classicism and ableist. Poverty is a systemic issue in a society of selective opportunities.,boston,0,0
493,245,2020-08-04T19:40:47.000Z,"My kid just emailed 
@wutrain
 to interview her for a slide deck she’s doing on why public transit should be free for all and my heart is bursting.",boston,0,0
494,246,2020-08-04T17:25:17.000Z,Sun always shines after the storm tho ,boston,0,1
495,247,2020-08-03T20:24:51.000Z,ripped my pants at work just like that episode of spongebob ,boston,0,0
496,248,2020-08-04T19:44:10.000Z,"Celebrating my birthday by aggressively overcaffeinating, enjoying a few mid-day jello shots, and watching Crazy Ex-Girlfriend for seven hours straight.",boston,0,0
497,270,2020-08-04T20:45:16.000Z,"Yesterday I ate a bag of baby carrots, a bag of Doritos and turmeric tofu, so today my poop is rust colored like I’m a sad robot.",boston,0,0
498,271,2020-08-03T20:03:56.000Z,"three glasses of rosé deep out to lunch with my friends and the waiter goes “we probably should’ve just done a bottle, huh?”

ok jeremy no need to judge me but yeah we fuckin should’ve",boston,0,0
499,0,2020-08-04T22:46:00.000Z,"If your GPA isn’t in your bio, I assume we can’t recruit you.",nyc,0,0
500,1,2020-08-04T22:14:49.000Z,"Your time, energy & effort is appreciated way more than someone gifting a ton of subs. Money comes n goes but true bonds stay.",nyc,0,0
501,2,2020-08-04T23:36:22.000Z,Bruh ask before you just go eating in someone’s car... if I dont rock with you lime that ITS NO EATING IN MY WHIP!,nyc,0,0
502,3,2020-08-04T20:12:17.000Z,People who lack empathy really confuse me because how hard is it to ask yourself “how would I feel if that were me?”,nyc,0,0
503,4,2020-08-04T20:58:25.000Z,Can we drop the “criminal” from “criminal justice”? I like “justice system” a lot better. People involved in the justice system are not criminals. They are people involved in the justice system. We need a shift from prescriptive to descriptive language. #LanguageMatters,nyc,0,0
504,5,2020-08-04T23:02:35.000Z,We really need more black women financial planners.,nyc,0,0
505,6,2020-08-04T21:44:08.000Z,"It’s still the Feast of St. John Vianney so pray for:

Your favorite priests
Your least favorite priests
Struggling priests
Sinful priests
Future priests
More priests",nyc,0,0
506,7,2020-08-04T22:04:46.000Z,This that spla’,nyc,0,0
507,8,2020-08-04T20:31:21.000Z,I don’t use measurements when seasoning my food. I just let the ancestors guide my hands.,nyc,0,0
508,9,2020-08-04T23:20:14.000Z,new normal: adding washable masks to your socks and underwear drawer,nyc,0,0
509,10,2020-08-04T23:00:48.000Z,"Gametime! Let’s go Matz, and let’s go #Mets! Let’s keep the bats hot 
 #LGM",nyc,0,0
510,11,2020-08-04T22:43:19.000Z,I don't think u guys understand how much we appreciate when yall come into chat even tho you're busy doing something to say hello n wish a good stream. That shit goes such a long way bro. Like 1-Ty for thinking of me. 2-Ty for looking up my channel 3-Ty 4 the good vibes,nyc,0,0
511,12,2020-08-04T21:58:45.000Z,No #Mets lineup yet and about an hour until gametime. Is everyone opting out?,nyc,0,0
512,13,2020-08-04T23:05:33.000Z,Sometimes I listen to the In The Heights soundtrack just to feel something,nyc,0,0
513,14,2020-08-04T22:25:02.000Z,"HOW TO HELP WITH THE CRISIS IN LEBANON: A THREAD

if you can’t donate rt it can save a life 
and if you know anything else that can help reply wit it 
#BeirutBlast #Beirut #PrayForLebanon #prayforbeirut #explosion",nyc,0,1
514,15,2020-08-04T23:23:49.000Z,I think graduating 2020 was a blessing in disguise ,nyc,0,0
515,32,2020-08-04T23:28:12.000Z,"Yall- my mom learned howta email on her own
 IM SO PROUD",nyc,0,0
516,33,2020-08-04T20:31:14.000Z,Social media got y’all delusional as fuck,nyc,0,0
517,34,2020-08-04T20:29:18.000Z,Just poured my heart and soul into this cover letter a position. Crossing my fingers I get an interview ,nyc,0,0
518,35,2020-08-04T22:08:29.000Z,"mercury = factual data 
jupiter = embodied wisdom 
saturn = ingrained lessons",nyc,0,0
519,68,2020-08-04T22:53:53.000Z,"I’m old enough to remember when 70K Manhattan residents lost power for 5hrs in July 2019 outage, which was national breaking news. Over 200K outer-borough residents are w/out power in a pandemic & are told it will take days to restore. Hope things are well in Manhattan & Hamptons",nyc,0,1
520,69,2020-08-04T19:50:53.000Z,The shorties who shame you for showing your body are usually just insecure about their own,nyc,0,0
521,70,2020-08-04T22:17:57.000Z,Y’all love to come on this bird ass app and lust over straight men when there are so many fine gay niggas. I hate to see it,nyc,0,0
522,71,2020-08-04T19:43:26.000Z,Prayers up for Beirut! ,nyc,0,0
523,72,2020-08-04T20:59:51.000Z,Thinking of all my friends in Beirut. ,nyc,0,0
524,73,2020-08-04T23:56:05.000Z,My taste in people in general change over the years ,nyc,0,0
525,74,2020-08-04T20:12:00.000Z,"Mannn, the last thing I remembered was leaving work early to pick Xen up from school and wait for this corona thing to pass. It’s been 5 months.",nyc,0,0
526,75,2020-08-04T22:46:26.000Z,God said yall racist in Staten Island let me take your electricity,nyc,0,0
527,76,2020-08-04T23:02:15.000Z,You don’t have to amplify the false information or bad information just because someone in power has said it.,nyc,0,0
528,97,2020-08-04T21:02:44.000Z,"Internet is out. New York is not really built for storms, or heatwaves, or snow, or pandemics...",nyc,0,1
529,98,2020-08-04T21:44:30.000Z,Work Harder,nyc,0,0
530,99,2020-08-04T21:14:33.000Z,"Books 
 ",nyc,0,0
531,100,2020-08-04T22:44:10.000Z,A great way to kill time during quarantine is to make a list of everyone who has ever wronged you,nyc,0,0
532,101,2020-08-04T20:36:53.000Z,I’m a proud public school kid ,nyc,0,0
533,123,2020-08-04T20:50:29.000Z,Moe I miss bartaco,nyc,0,0
534,124,2020-08-04T23:27:45.000Z,"My heart goes out to all my Lebanenese friends & countrymen/women . What a tragic event today and chaotic year it has been for their country. I pray / hope casulties  are minimum and speedy recovery for all the injured. Sincere wishes & prayers from 
  to  ",nyc,0,1
535,125,2020-08-04T22:30:03.000Z,Season two of HARLEY QUINN is the only good thing 2020 has given us.,nyc,0,0
536,126,2020-08-04T22:10:17.000Z,"i was sad to be graduating a year early from NYU because i truly loved  undergrad, but now i see i lucked out since i don’t have to pay full NYU real estate tuition for an all-online experience lol",nyc,0,0
537,148,2020-08-04T20:19:08.000Z,Did eveyone just wake up today & realize Thoroughly Modern Millie was racist? How did you escape the experience of your all white high school age production of it that you reflected on years later with horror?,nyc,0,0
538,149,2020-08-04T23:59:17.000Z,Love when I get complimented without being sexualized,nyc,0,0
539,184,2020-08-04T22:36:18.000Z,Phil has always known!!! Should’ve let him trade KP for Booker ,nyc,0,0
540,185,2020-08-04T23:15:39.000Z,Happy women arent hating and hating women ain’t happy. Better check your situation,nyc,0,0
541,186,2020-08-04T22:04:30.000Z,"People will be like- “”support the arts! People who work in entertainment are struggling! They need help!””
Then 5 mins later those same people will be like.- you want me to .... pay :/ over $10??... for this piece of work that cost billions to make. .... :/",nyc,0,0
542,187,2020-08-04T23:49:05.000Z,Prayers for Beirut as they deal with this horrible moment,nyc,0,1
543,188,2020-08-04T22:47:32.000Z,a part of me is low key obsessed with how most of the adverstiments in the subway stops are all from pre covid feels very post-apocalyptic,nyc,0,0
544,189,2020-08-04T21:42:51.000Z,"new jersey was in a state of emergency today for the hurricane. it rained for 5 mins & is now sunny.

this is 2020.",nyc,0,1
545,190,2020-08-04T21:34:01.000Z,Should the Presidential debates be moved up earlier due to the expansion of early / mail-in voting?,nyc,0,0
546,191,2020-08-04T22:24:11.000Z,they say they can’t enforce kids to wear masks but do y’all remember getting dress coded in hs and if you didn’t have anything to cover up they would MAKE u wear that big ass dusty t-shirt,nyc,0,0
547,210,2020-08-04T21:12:53.000Z,"they had to put my dog down today 
 almost a year from when jacob passed. at least they get to run around together again. i love you seven.",nyc,0,0
548,211,2020-08-04T19:39:02.000Z,the rosemary mint oil from mielle is really the truth,nyc,0,0
549,212,2020-08-04T23:50:38.000Z,"Hurricane Isaias knocked out my power, so I was forced to use an external battery charger to charge my iPhone so I could swipe matches on Tinder, just like boomers used to in their flip phones during Hurricane Andrew",nyc,0,1
550,213,2020-08-04T21:17:55.000Z,I want to go on a vacation already without having to worry about this virus ,nyc,0,0
551,231,2020-08-04T23:09:26.000Z,Setting up my hookah is a form of self care.,nyc,0,0
552,232,2020-08-04T20:24:42.000Z,"Y’all don’t want a socialist government but, here we are, crowdfunding healthcare, human rights, education, disaster relief, etc, with our post-tax dollars",nyc,0,0
553,233,2020-08-04T21:20:15.000Z,someone said i seemed like a capitalist in my tiktok live today & my socialist ass took it as a compliment bc i often do say my productivity addiction is a capitalist’s dream,nyc,0,0
554,234,2020-08-04T19:52:37.000Z,My body is literally a work of art lmao Im def gon show it off,nyc,0,0
555,253,2020-08-04T21:32:51.000Z,Beirut. Just Beirut.,nyc,0,0
556,254,2020-08-04T22:03:44.000Z,I’m the best ping pong player in the league,nyc,0,0
557,255,2020-08-04T22:01:56.000Z,after almost five months it took me only three days to not be excited about watching a rangers game. very healthy relwtionship I have with this team!!!,nyc,0,0
558,256,2020-08-04T21:37:37.000Z,"Why is it so hard to stay friends with an ex*?

*stranger I’ve never actually met but that doesn’t mean he wasn’t my boyfriend",nyc,0,0
559,290,2020-08-04T20:32:42.000Z,the way my passport already arrived in less than a month and they said it was gonna take 3 or more...,nyc,0,0
560,291,2020-08-04T21:24:23.000Z,Hoping to echo beyond my actual end.,nyc,0,0
561,292,2020-08-04T23:13:45.000Z,Real talk Americans should be embarrassed it takes a foreign journalist to come TO OUR LAND and grill OUR LEADER. Our mainstream media is the enemy at the door. They are the one who knocks.,nyc,0,0
562,293,2020-08-04T21:28:29.000Z,My superpower is : * you have 2 minutes left to drop off your bag * ... but I made it ,nyc,0,0
563,294,2020-08-04T21:19:10.000Z,Disappointed for Brentford. Would have liked to see them succeed after their steady & thoughtful progress over the last few years.,nyc,0,0
564,295,2020-08-04T20:13:42.000Z,Everyone in my neighborhood is walking around taking pictures of downed trees.,nyc,0,1
565,296,2020-08-04T22:28:54.000Z,"Tonight’s #Mets lineup (finally)

Nimmo LF
J.D. Davis 3B
Alonso 1B
Ramos DH
Conforto RF
Dozier 2B
Cordell CF
Giménez SS
Nido C

Matz LHP

#LGM",nyc,0,0
566,316,2020-08-04T22:31:59.000Z,Devin Booker different bruh. Different.,nyc,0,0
567,317,2020-08-04T23:16:20.000Z,Late 80’s horror films have the best look. Dark and gritty.,nyc,0,0
568,318,2020-08-04T22:09:26.000Z,"Listen close. I’m putting it out there that I want to shoot a 
@clarksshoes
 campaign with 
@sterling7
 in Jamaica.",nyc,0,0
569,319,2020-08-04T21:42:22.000Z,"In the middle of an intense day, I want to thank our extraordinary school food workers, school cleaners, school safety, and crossing guards for working today to keep grab and go sites open to provide meals for families.",nyc,0,0
570,338,2020-08-04T20:45:05.000Z,"‘due to the pandemic and the politicization of postal service funding, your author copies shipment may be delayed’ is not a template email I thought I’d need but here we are!",nyc,0,0
571,339,2020-08-04T22:16:49.000Z,"Story time: a few years ago on a date I tried to impress a boy by singing “Love For Sale” at an open mic night in a cute cafe. to this day it’s my best live performance but it also gave him the very wrong idea...

and this is why I no longer sing in public",nyc,0,0
572,340,2020-08-04T21:11:27.000Z,RETWEET if you’ve ever been told that you write like a girl,nyc,0,0
573,358,2020-08-04T20:16:17.000Z,"“I don’t know John Lewis.” Is about the most on target thing 
@potus
 has ever said.",nyc,0,0
574,359,2020-08-04T22:31:05.000Z,"Trump: “Our national Covid-19 numbers would be quite low if you just take out New York, New Jersey and maybe Connecticut.”",nyc,0,0
575,360,2020-08-04T22:31:59.000Z,there’s a mouse under my dishwasher and i just can’t function right now because of my fear of small rodants ,nyc,0,0
576,361,2020-08-04T19:38:14.000Z,"The thing about Twitter is sometimes you miss things because... well...sometimes you’re working.  And then later you see the thing everyone was hours ago laughing together.  So now you laugh about it, too, but now you’re laughing alone.",nyc,0,0
577,379,2020-08-04T20:53:34.000Z,"With all the power outage going around. Now is an excellent time to support @NYCDSA_Climate’s public power bill. Energy should be owned and run by the community, not large corporations like Con Edison.",nyc,0,0
578,380,2020-08-04T22:37:28.000Z,"The reason for the EXTRAORDINARY TikTok deal — ostensibly — is to protect America’s national security.  

“What’s in it for us?” is a bizarre question in this context.

Protecting America’s national security — a vital national interest — is the value.",nyc,0,0
579,409,2020-08-04T22:01:14.000Z,"If I were a parent, I would be the jerk kind that flat out banned all live-action Disney remakes on the grounds of terminal banality.",nyc,0,0
580,410,2020-08-04T20:54:30.000Z,for some reason i feel like i cant hear shit with these mask on ...,nyc,0,0
581,411,2020-08-04T20:44:31.000Z,Baby that storm did a number on the trees in BK!!!!,nyc,0,1
582,412,2020-08-04T22:21:15.000Z,think i need a quick nap. if i’m not tweeting by 830 pls send wake up squad,nyc,0,0
583,413,2020-08-04T23:55:41.000Z,Drinking at home is so much more productive than going out. I spent like an hour manually recalibrating my TV last night. Then I spent the next 30 minutes playing guitar badly before tucking myself into bed at precisely 10:30 PM.,nyc,0,0
584,414,2020-08-04T22:57:32.000Z,my therapist’s power went out mid session.... doesn’t bode well for me in more ways than one,nyc,0,0
585,415,2020-08-04T23:05:28.000Z,We’re all going to be so much better at quarantine birthdays next year,nyc,0,0
586,416,2020-08-04T21:24:56.000Z,"Stomach will embarrass you, with the way the bus is dancing, my boobs are the ones that’s supposed to be doing gbaga gbaga but it’s my stomach that’s doing poto poto ",nyc,0,0
587,417,2020-08-04T22:37:53.000Z,Me and Osp still LF1 for ccs,nyc,0,0
588,0,2020-08-03T21:43:58.000Z,does anyone ever just sit in their car and listen to music? because same,joplin,0,0
589,1,2020-08-04T15:16:15.000Z,“Forget your excuses. You either want it bad or don’t want it at all.” #GoodMorning,joplin,0,0
590,2,2020-08-04T22:27:36.000Z,can’t get over that some men think catcalling is a way to compliment women ,joplin,0,0
591,3,2020-08-03T05:14:11.000Z,In 2 1/2 weeks I’ve already froze almost 100 ounces of milk,joplin,0,0
592,4,2020-08-03T23:10:31.000Z,"Crazy that reds have sonny gray, Luis Castillo, and Trevor Bauer all in the same rotation.",joplin,0,0
593,5,2020-08-04T22:19:15.000Z,"Did he just say ""underlining conditions""?",joplin,0,0
594,6,2020-08-04T02:22:56.000Z,"reminder that even if you yourself wouldn’t get an abortion but are fine with other people getting one, that doesn’t make you pro life for yourself, that literally just means you believe it’s the choice of the person (aka pro choice)",joplin,0,0
595,7,2020-08-04T13:29:12.000Z,Winter better not be coming early or ima be pissed lol,joplin,0,0
596,8,2020-08-03T11:25:35.000Z,The gym hits different before 6am,joplin,0,0
597,9,2020-08-04T18:48:15.000Z,Morgans going to see Koe tonight and I have to work.. Most adult decision I’ve ever made in my life ,joplin,0,0
598,10,2020-08-03T20:47:00.000Z,This OKC game is so sloppy,joplin,0,0
599,11,2020-08-04T04:32:12.000Z,What a great freaking stream tonight. That’s the most fun I’ve had playing Apex in a very long time.,joplin,0,0
600,12,2020-08-03T15:55:35.000Z,"That new Gary Allan song is too damn good! Such a simple song idea, but it’s so damn true. 100% real life.",joplin,0,0
601,13,2020-08-04T19:09:49.000Z,My integrity will not allow me to build a lower third for a puppet.,joplin,0,0
602,14,2020-08-03T23:38:07.000Z,Council Bill 2020-268 passes 8 in favor with 1 absent. Duplex is going up on 26th street!,joplin,0,0
603,15,2020-08-03T23:36:38.000Z,"Speaking in favor of the Re-zoning bill, Dylan Coonrod, contractor from Weir, KS.",joplin,0,0
604,16,2020-08-03T04:09:11.000Z,you’re a piece of shit you’re a piece of shit you’re a piece of shit you’re a piece of shit you’re a piece of shit you’re a piece of shit,joplin,0,0
605,17,2020-08-03T03:57:59.000Z,am cold,joplin,0,0
606,18,2020-08-04T18:10:54.000Z,I hate getting notifications and its not someone who wants to talk to me.,joplin,0,0
607,19,2020-08-04T05:02:50.000Z,Hype me up,joplin,0,0
608,71,2020-08-03T17:28:37.000Z,"I would say the only thing I “simp” for is a cali nigga in a sweat suit, clean shoe game, and a sweet heart 
 just sumn about em",joplin,0,0
609,72,2020-08-03T16:56:56.000Z,I feel like these bitches is plottin. Too many snakes slidin in my phone ,joplin,0,0
610,73,2020-08-03T00:05:18.000Z,"I’m curious...could these P5 colleges use some of the money they use to build ridiculous facilities and crazy salaries to help save non-revenue sports, and/or honor scholarships of those athletes who will lose their seasons due to COVID-19?",joplin,0,0
611,74,2020-08-03T20:56:35.000Z,Good lord I can’t stop crying today. ,joplin,0,0
612,75,2020-08-04T18:52:10.000Z,"this is a thread to help Lebanon. I have been seeing many Lebanese moots saying petitions dont work due to their government, so I have not linked any. If there are some that work or I am misinformed pls correct me, as I’m only trying to spread awareness, educate, & send help !!",joplin,0,0
613,76,2020-08-03T23:42:27.000Z,Council Bill 2020-269 rezoning request for 2701 S. Virginia. Joe Moore requesting. Build a single or duplex with oversize parking.,joplin,0,0
614,77,2020-08-04T00:24:04.000Z,did you sing Katy Perry’s “Peacock” at the top of your lungs when you were 10 or were you normal?,joplin,0,0
615,78,2020-08-03T15:33:25.000Z,So ready to move to KC! ,joplin,0,0
616,79,2020-08-04T05:01:45.000Z,Wait wait wait a damn minute you telling me tommy in Belly was a coo the whole time,joplin,0,0
617,80,2020-08-04T20:34:11.000Z,"Well I have a 
@KoeWetzel
 loving 4 week old
 we were crying until I turned on Sundy or Mundy",joplin,0,0
618,81,2020-08-04T01:26:19.000Z,I can nap with my dogs for hrs,joplin,0,0
619,82,2020-08-04T03:40:20.000Z,omg do you guys remember that game with the alligator and the pipes with the water??,joplin,0,0
620,103,2020-08-04T03:42:25.000Z,Why does Missouri have such a huge flow arts thing,joplin,0,0
621,104,2020-08-03T15:17:58.000Z,Every time Eli streches in his sleep he lets out a big toot,joplin,0,0
622,105,2020-08-03T15:29:52.000Z,My last week in Missouri before I head back home to Texas. ,joplin,0,0
623,106,2020-08-03T23:26:50.000Z,Welp my microphone looks like it broke on move so I’m trying to fix it but idk if it will work!,joplin,0,0
624,107,2020-08-04T15:20:36.000Z,"Jesus Christ. Im so freaking tired of this 
 emoji. ",joplin,0,0
625,129,2020-08-04T20:35:42.000Z,There’s something so pure about playing wiffle-ball baseball in the middle of the neighborhood street :),joplin,0,0
626,130,2020-08-04T02:06:40.000Z,"Cant Wait To Sit Ina Dark Next To Ah Lamp Ona Bitch 

So where u been all night ",joplin,0,0
627,131,2020-08-04T19:23:38.000Z,"praying for you Lebanon. so hard, i have donated, educated myself and others, im doing all i can, this breaks my hearts. healing and love to everyone there ",joplin,0,0
628,167,2020-08-03T12:07:00.000Z,"Has 
@ChickfilA
 ever gave someone the wrong order?",joplin,0,0
629,168,2020-08-04T10:52:42.000Z,"Good morning everyone hope you guys have a wonderful day today!
Also who is pumped for season 5 in modern warfare?",joplin,0,0
630,169,2020-08-03T03:11:27.000Z,i wanna kiss a girl serious inquiries only,joplin,0,0
631,170,2020-08-04T03:52:56.000Z,How many times do you have to retweet yourself before people start thinking you and yourself should vet a room,joplin,0,0
632,171,2020-08-03T21:16:38.000Z,"I hate it when theres a song I hear pretty often, and its not a band I generally listen to, but one I should at least know the name to.  Cant remember anything about the band name or song but for some reason I really want to listen to it.",joplin,0,0
633,172,2020-08-04T17:25:25.000Z,Got some bad news about my aunt just now and idk if I’ll be streaming for a few days... hope you guys understand,joplin,0,0
634,173,2020-08-03T22:56:37.000Z,Idc how much money I got a bitch will never get a cut,joplin,0,0
635,174,2020-08-03T23:29:59.000Z,"Everybody loves a playmaker, who will be the tops backs, receivers and tight ends in 2020?",joplin,0,0
636,175,2020-08-03T15:28:45.000Z,We’ll be rolling out our lists of the top football players by position entering the 2020 season. Who are some quarterbacks we should keep an eye on this fall?,joplin,0,0
637,0,2020-08-04T23:47:19.000Z,I plan on buying a new car by the end of December! #speakingintoexistance,houston,0,0
638,1,2020-08-04T20:06:57.000Z,LITERALLY COST $0 TO SUPPORT YOUR FRIENDS BUSINESSES OR ACCOMPLISHMENTS,houston,0,0
639,2,2020-08-04T23:58:04.000Z,"It was good Houston but I’m on a mission 
 #SABOUND",houston,0,0
640,3,2020-08-04T22:44:49.000Z,I got hired at Total Wine!,houston,0,0
641,4,2020-08-04T21:06:45.000Z,"A lot of y’all really can’t drive and quite honestly, it’s frightening",houston,0,0
642,5,2020-08-04T22:39:46.000Z,i’d run across the river just to hold you tonight,houston,0,0
643,6,2020-08-04T20:17:03.000Z,Don’t cost a dime to be real but it cost a lot to keep up the fake persona with them material purchases and all,houston,0,0
644,7,2020-08-04T23:58:02.000Z,"COVID-19 made unprecedented challenges to establish a program! Being new this year meant going through this process virtually & developing a culture that didn’t exist. It’s gone fairly well & I’m proud of our Apollos and Coaching staff for overcoming obstacles.
#ApollosFB",houston,0,0
645,8,2020-08-04T18:53:14.000Z,"you’re already that person, so put yourself in that place.",houston,0,0
646,9,2020-08-04T23:56:12.000Z,I don’t give people access to me at all.,houston,0,0
647,10,2020-08-04T20:33:39.000Z,You want to know why some of us get tired and overwhelmed with all the bad in the world? It’s not because we don’t know Jesus. It’s because you all act like y’all don’t when you look away from the sufferings of other people. (1/x),houston,0,0
648,11,2020-08-04T23:38:42.000Z,"i’ll tell you what’s worse than heartbreak, not being able to play soccer because you’re hurt",houston,0,0
649,12,2020-08-04T22:12:21.000Z,Time for a new environment..#LittleRock,houston,0,0
650,13,2020-08-04T22:02:22.000Z,selling dozens of chocolate covered strawberries for $15 !! dm me ,houston,0,0
651,14,2020-08-04T20:46:03.000Z,I want to go on a date bye ,houston,0,0
652,15,2020-08-04T22:37:44.000Z,"How is 
@Begreat_20
 doing???",houston,0,0
