,Unnamed: 0,date,contents,city,city_in_disaster,target
151,13,2020-08-04T17:33:48.000Z,"Cody’s hurt and I told him I was gonna spend my whole day taking care of him and he said “day? I need u to take care of me your whole life” lmao poor thing, he’s cute tho ",atlanta,0,0
152,14,2020-08-04T22:03:21.000Z,Aid >>>>>>>>>>>>>>> prayers,atlanta,0,0
153,15,2020-08-04T19:07:05.000Z,"I remember when we would give aid and send words of support.

Seems like ages ago.",atlanta,0,0
154,16,2020-08-04T16:47:41.000Z,I gave EVERYONE respect before I disrespected them for disrespecting me or making me feel disrespected ,atlanta,0,0
155,17,2020-08-04T18:19:25.000Z,Normalize calling undershirts tank tops and not wife-beaters....,atlanta,0,0
156,18,2020-08-04T22:37:28.000Z,My problem is when I like you I think we together,atlanta,0,0
157,38,2020-08-04T19:12:24.000Z,Praying for the people in Lebanon fr ,atlanta,0,1
158,94,2020-08-04T22:48:25.000Z,"man remember from like 2017-2018 when every other week some article would outline Trump's latest hilariously illegal act and a bunch of people would repost it with commentary like ""WE FINALLY GOT HIM""",atlanta,0,0
159,95,2020-08-04T22:19:32.000Z,"BREAKING NEWS: Marietta City Schools confirms 5 teachers have tested positive for COVID-19. 
@cbs46",atlanta,0,1
160,96,2020-08-04T23:59:05.000Z,I’m such an empath,atlanta,0,0
161,97,2020-08-04T22:45:30.000Z,I ain’t fw these bitches who just lookin for a come up,atlanta,0,0
162,98,2020-08-04T23:41:46.000Z,"Splash down homer for Matt Adams! I didn’t know we had splash down homers! 

#ForTheA",atlanta,0,0
163,99,2020-08-04T20:45:35.000Z,I wish grandmas could live forever. ,atlanta,0,0
164,100,2020-08-04T21:27:17.000Z,"“Organizing is about changing the material conditions yes, but organizing is also about changing the spirtual conditions as well”

-Mary Hooks",atlanta,0,0
165,101,2020-08-04T17:32:50.000Z,"Because at times of hell, even the hardest men, we forget how hard we really are. Suffering is the true test of life. You face everyday. You face it every single day of your life.",atlanta,0,0
166,102,2020-08-04T12:50:30.000Z,"i never posted pictures on twitter before 
 maybe ill do that soon",atlanta,0,0
167,103,2020-08-04T18:09:04.000Z,Some of y’all could use a chill pill. The Braves will be fine and AA will figure it out.,atlanta,0,0
168,104,2020-08-04T23:51:55.000Z,just deleted all my dating apps. actually giving a real boy a chance.,atlanta,0,0
169,105,2020-08-04T22:38:20.000Z,I know I’m lit cus if I cut everybody in my life off I won’t lose shit or skip a beat. No kizzy,atlanta,0,0
170,106,2020-08-04T20:33:30.000Z,"question for the plugs in huntington, started any investments yet? or y’all still staying with yalls parents, with no car & every pair of jordan’s?",atlanta,0,0
171,127,2020-08-04T23:33:04.000Z,The baby has graduated from eating tissue to dirt out of my plant pots.,atlanta,0,0
172,128,2020-08-04T20:39:41.000Z,At the end all your left with is memories.,atlanta,0,0
173,129,2020-08-04T20:07:20.000Z,Came to the doctor for a checkup and these folks done came in here with this long ass Q-tip... ,atlanta,0,0
174,130,2020-08-04T07:19:08.000Z,if you had a messenger bag with buttons and pins on it in middle school i trust you,atlanta,0,0
175,151,2020-08-04T22:28:25.000Z,HOLY SHIT DEVIN BOOKER,atlanta,0,0
176,152,2020-08-04T21:41:17.000Z,"girlfriends > boyfriends
Lol it’s kinda not up for debate either.",atlanta,0,0
177,153,2020-08-04T23:17:25.000Z,Austin Riley you better be careful. I swear I'm wrapping them all in bubble wrap,atlanta,0,0
178,208,2020-08-04T18:09:54.000Z,"Happy Birthday 
@BarackObama
! I love you and miss you.",atlanta,0,0
179,209,2020-08-04T16:00:27.000Z,You breath different after that COVID test go up ya nose,atlanta,0,0
180,210,2020-08-04T23:01:00.000Z,"Just flew 
@Delta
. They still have the mask rule with no medical exemptions but they do allow alcohol so they aren’t power tripping on control, & they were friendly. 

Better than any other airline I have flown during this Covid power trip, especially 
@SouthwestAir
 <~ bad rn FYI",atlanta,0,0
181,211,2020-08-04T19:03:33.000Z,Now that I finished with my website it’s time to give you all non stop content ,atlanta,0,0
182,212,2020-08-04T21:03:56.000Z,"I won’t be sponsoring any trips unless it’s extremely special case i.e. honeymoon or birthday presents. 

Y’all have lost y’all minds",atlanta,0,0
183,213,2020-08-04T22:40:57.000Z,"what is the financial incentive to send the kids to school in-person now? 

i’ve missed that point? like how much money are this many lives “worth?”",atlanta,0,0
184,214,2020-08-04T18:17:39.000Z,"A thought to keep:
When we let our eyes or our feet take us to places that God wouldn't bless, we lose our desire to praise and give thanks.",atlanta,0,0
185,215,2020-08-04T23:43:15.000Z,Forex Traders act just like the nigga at the mall who always tryna clean yo shoes,atlanta,0,0
186,216,2020-08-04T21:10:48.000Z,y’all deadass attacking Unemployment people for recieving unemployment checks but don’t say nothing to mf’s scamming for 10k??,atlanta,0,0
187,217,2020-08-04T17:42:43.000Z,Have a great day everyone ,atlanta,0,0
188,218,2020-08-04T11:38:44.000Z,Breathe and believe in you.,atlanta,0,0
189,219,2020-08-04T22:29:31.000Z,Devin Booker is the truth lol,atlanta,0,0
190,220,2020-08-04T23:57:16.000Z,black people have created damn near everything ,atlanta,0,0
191,221,2020-08-04T16:16:58.000Z,"I love my school District 
@apsupdate
 #AtlantaPublicSchool
#DisrupttheFear
#Walkinginyourgift
Awesome Intro From My Superintendent 
@DrLisaHerring
 
@skyeduck
@Akingsmith1
 
@EmilyBoatright
 @DouglassHSMedia
 
@ArtsINTEGRATE
 
@ArettaBaldon",atlanta,0,0
192,222,2020-08-04T16:48:46.000Z,Yeah... idc what’s trending. I’m not bleaching my eyebrows ,atlanta,0,0
193,223,2020-08-04T15:06:37.000Z,Braves GM Alex Anthopolous is hopping on a conference call with reporters at 11:30 am ET today,atlanta,0,0
194,243,2020-08-04T17:43:09.000Z,I spent like 10 racks in my mouth bruh smh. Be happy I’m responsible cuz I could’ve took yo hoe to Cabo with that,atlanta,0,0
195,244,2020-08-04T15:02:41.000Z,Not one boring day at my job. Just caught two residents on camera having sex outside the parking garage. It’s only Tuesday. ,atlanta,0,0
196,245,2020-08-04T14:34:25.000Z,"You know of me , you don’t know me ....relax",atlanta,0,0
197,246,2020-08-04T14:39:53.000Z,"I really believe Bryse Wilson gets the call-up today while AA is on the phone searching for trade partners. At bare minimum, I would prefer Bryse in the LR Chacin/Rusin role anyway. 
#ForTheA",atlanta,0,0
198,0,2020-08-04T23:59:46.000Z,"Chicago rapper FBG Duck has passed away, RIP ",fukishama,0,0
199,1,2020-08-04T23:59:48.000Z,Idk who needs to hear this but spirit animal jokes are appropriation,fukishama,0,0
200,2,2020-08-04T23:59:53.000Z,should I say “the great game” after my tip loses to sound astute,fukishama,0,0
201,3,2020-08-04T23:59:56.000Z,Every successful person has a story to tell...,fukishama,0,0
202,4,2020-08-04T23:59:59.000Z,just got tested for covid and as soon as the nurse pulled the swab out of my frontal lobe she dropped it on the ground.,fukishama,0,0
203,5,2020-08-04T23:59:55.000Z,"If you're breathing, 
you're still in the game.",fukishama,0,0
204,6,2020-08-04T23:59:46.000Z,"Anyone notice that the Twitter ""Dr's"" have hung up their shingles and are now explosives experts? #BeirutBlast",fukishama,0,0
205,7,2020-08-04T23:59:50.000Z,thinking about how i had a period for over a year and all the doctors were like damn that’s crazy good luck tho,fukishama,0,0
206,8,2020-08-04T23:59:50.000Z,Durk had to go live to show us he was on the plane when that happen,fukishama,0,0
207,9,2020-08-04T23:59:48.000Z,OMFG I GOT APPROVED FOR MY BBL LOAN LMAOOOOO!!,fukishama,0,0
208,10,2020-08-04T23:59:58.000Z,"Date fine boy u say no
U see now u can't do lomotif",fukishama,0,0
209,11,2020-08-04T23:59:43.000Z,I want all my friends to get recognized for their talents,fukishama,0,0
210,12,2020-08-04T23:59:52.000Z,U only exist if I allow you to this my world!,fukishama,0,0
211,13,2020-08-04T23:59:47.000Z,i’m hot but only when i’m wearing sunglasses in a small town liquor store,fukishama,0,0
212,14,2020-08-04T23:59:51.000Z,living at mac is just being forced to choose between shopping at kowalskis and whole foods,fukishama,0,0
213,15,2020-08-04T23:59:56.000Z,the government should just pay for all education full stop,fukishama,0,0
214,16,2020-08-04T23:59:43.000Z,"HOLY COW.

I am shaking. That was incredible.

Looked like a successful hop! Stand by for official confirmation, though! 
 #Starship #SN5",fukishama,0,0
215,17,2020-08-04T23:59:55.000Z,"I’m gonna hop on a plane and just move to Colorado, I hate it here :( LOL",fukishama,0,0
216,18,2020-08-04T23:59:51.000Z,"Hey 
@ESPNFantasy
 , Im trying to create a league but I’m given zero tools to edit the scoring/format to our participants liking. My 11 friends and I are not afraid to take our talents to Yahoo so I suggest you respond to this tweet with some serious facts #glizzy",fukishama,0,0
217,38,2020-08-04T23:59:54.000Z,"Hoooo not that native 
Every time I try to type “ago,” it automatically corrects it to “aho” ",fukishama,0,0
218,78,2020-08-04T23:59:56.000Z,"I would also argue $30 to rent MULAN is intentionally ""too high."" It still solidifies MULAN as a premium product and not just another VOD flick. The mistake of the streaming era was getting consumers used to the idea of ""almost nothing"" as a reasonable price for a big new movie.",fukishama,0,0
219,79,2020-08-04T23:59:56.000Z,Y’all remember when we literally pulled a “Hail Mary” with Trollz all because they doubted us? let’s do it again with “Move Ya Hips” I would like to break another record ,fukishama,0,0
220,80,2020-08-04T23:59:50.000Z,Sweet akong girlfriend wala nga lang boyfriend.,fukishama,0,0
221,81,2020-08-04T23:59:52.000Z,Bring on the numbers.,fukishama,0,0
222,82,2020-08-04T23:59:45.000Z,They ain’t believe in me.. still don’t,fukishama,0,0
223,83,2020-08-04T23:59:55.000Z,Let's face it. One of the reasons that teachers have political clout is because they are taxpayer paid babysitters. Parents will support striking teachers because its cheaper to pay a little more in taxes then quit your job or find all day daycare.  So teachers not wanting to go,fukishama,0,0
224,84,2020-08-04T23:59:56.000Z,"oH mY gOD yOu’RE tAlKiNg aBoUt sEx oN tWiTteR 
tHaT’s sOoOoOo uNLaDyLiKe 
 i cAn’T reSpECt yOu aNyMoRE 
 pack it up bitch boy",fukishama,0,0
225,85,2020-08-04T23:59:56.000Z,Trees need to step up their game...just falling down from a little wind! Abysmal performance from the trees of northern New Jersey today,fukishama,0,0
226,86,2020-08-04T23:59:47.000Z,SN-5 LIVES!!!,fukishama,0,0
227,87,2020-08-04T23:59:52.000Z,"My whole body hurts, I can't feel my legs due to the shock
I feel emotionally drained trying to process what happened today
I'm afraid to close my eyes so I won't wake up to another bomb, glass shatering or loosing a beloved one
I just feel numb. 
They killed the soul of Lebanon.",fukishama,0,1
228,88,2020-08-04T23:59:59.000Z,I wish I could listen to Chum by Earl Sweatshirt again for the first time,fukishama,0,0
229,89,2020-08-04T23:59:50.000Z,"I picked a hell of a time to get into school administration! Whatever the model, let’s continue putting our students first in all that we do.",fukishama,0,0
230,90,2020-08-04T23:59:47.000Z,Sometimes you gotta do yo own shit,fukishama,0,0
231,91,2020-08-04T23:59:48.000Z,"Me: You guys are done with video games today!

My 9 year old: FINE BUT I'M GOING TO EAT EVERY FOOD WE HAVE IN THE HOUSE!

Me: FINE!

#parenting",fukishama,0,0
232,110,2020-08-04T23:59:38.000Z,Nice to break 14000 followers today. I’d say how about that verification but not sure that blue checkmark means much. Seen some of those tweets. ,fukishama,0,0
233,111,2020-08-04T23:59:57.000Z,notification squad wya,fukishama,0,0
234,112,2020-08-04T23:59:55.000Z,i was watching a swedish show and i was like hmm sweden seems calm uno....imagine if someone in sweden watched Aifric and thought hmm ireland seems calm,fukishama,0,0
235,113,2020-08-04T23:59:49.000Z,shrimp n steak cause court tomorrow just in case the judge wilding out,fukishama,0,0
236,132,2020-08-04T23:59:46.000Z,"middle school: 1D wall 
high school: Scripture Wall 
college: Painting wall 

clearly I’m a whore for a single wall to be dedicated to some typa theme lmaooo y am I like this ",fukishama,0,0
237,133,2020-08-04T23:59:56.000Z,"Police Unions - We are allowed to kill and break the law and there's nothing you can do about it.
Government - Very good.
Teacher's Unions - School is unsafe and we don't want our members to die. Let's work together to find a solution
Government - Selfish, we will abolish you.",fukishama,0,0
238,219,2020-08-04T23:59:52.000Z,if i ship nearly every wlw katara ship no i don’t but i do no ,fukishama,0,0
239,220,2020-08-04T23:59:51.000Z,man it’s official. i have the sleep schedule of a 30 year old male,fukishama,0,0
240,221,2020-08-04T23:59:44.000Z,Sandra Smith was being a little bitch with Mercedes! Why the rudeness? Mercedes trying to explain the faults with mail in ballots and Sandra really rudely dismiss that as silly worry!,fukishama,0,0
241,222,2020-08-04T23:59:58.000Z,Had to unfollow my sorority cause honestly I’m embarrassed I was ever part of that and idc who sees this,fukishama,0,0
242,223,2020-08-04T23:59:48.000Z,u dont have to be so cautious if u practice what you preach,fukishama,0,0
243,224,2020-08-04T23:59:58.000Z,"Devin Booker really hit a game-winner while double teamed by two elite defenders. We already knew he was different, but sheesh!",fukishama,0,0
244,225,2020-08-04T23:59:54.000Z,THEY DID IT! Starship hop success!,fukishama,0,0
245,226,2020-08-04T23:59:49.000Z,just got a sword from a woman with 5 other swords in her bare chest and increased my max hp,fukishama,0,0
246,227,2020-08-04T23:59:56.000Z,"Onlyfans link in bio for a limited time 
 top .96% !",fukishama,0,0
247,228,2020-08-04T23:59:48.000Z,"oh we're big braining tonight,,, i dont trust u anymore by left @ london is a david 7 song in many ways",fukishama,0,0
248,229,2020-08-04T23:59:57.000Z,"Tornado warnings , crippling rain,  incredible winds ... yet all I see and feel is you in the sunset and the brightness of the moon and stars .",fukishama,0,1
249,230,2020-08-04T23:59:52.000Z,"“My muscles shrink when I stop exercise” - ok. 

“My body smells when I stop showering” - really 

“My blood glucose & weight go up when I stop my nutrition plan” - ",fukishama,0,0
250,231,2020-08-04T23:59:45.000Z,"* I HATE RELAXING!!
* I LOVE being ANGRY and STRESSED OUT!!!",fukishama,0,0
251,232,2020-08-04T23:59:54.000Z,just saw a corona commercial that had a khruangbin song playing .... can't believe i stan lagers now,fukishama,0,0
252,233,2020-08-04T23:59:47.000Z,"in less than 24 hours, my blonde era will be over",fukishama,0,0
253,234,2020-08-04T23:59:57.000Z,RIP FBG Ducc foo dayum,fukishama,0,0
254,235,2020-08-04T23:59:49.000Z,I need some sexercise,fukishama,0,0
255,255,2020-08-04T23:59:51.000Z,Stay positive through the negative situations,fukishama,0,0
256,256,2020-08-04T23:59:56.000Z,i just realized that i took photos in ac with the screenshot button instead of the + sign... so the guide is still on it BECAUSE I’M STUPID ,fukishama,0,0
257,257,2020-08-04T23:59:46.000Z,"We're closed, btw.",fukishama,0,0
258,0,2020-08-03T04:28:32.000Z,investing into my spiritual growth during this quarantine has been the best decision,austin,0,0
259,1,2020-08-04T21:48:25.000Z,Remembering you have money in your Venmo account is like finding cash in your clothes ,austin,0,0
260,2,2020-08-04T19:36:29.000Z,"playing my favorite game of “does my throat hurt because of covid, allergies or anxiety”",austin,0,0
261,3,2020-08-04T13:13:17.000Z,"Happy birthday, Pj 
 I love and miss you forever ",austin,0,0
262,4,2020-08-03T15:36:45.000Z,"It’s been a long 4 months. Happy you all joined the ride and followed my reporting about the #XFL and the sales process. 

Hope to do the same in the coming months, years, forever. 

Now let’s all say in celebration! 

#FortheLoveofFootball",austin,0,0
263,5,2020-08-03T23:24:21.000Z,I may suffer from anxiety and depression but I’ve never participated in a pyramid scheme and I live by that,austin,0,0
264,6,2020-08-04T17:02:55.000Z,Don’t think the same as everyone else,austin,0,0
265,7,2020-08-04T17:31:56.000Z,Self-destruct activated,austin,0,0
266,8,2020-08-04T00:53:36.000Z,"Okay Missouri friends, all 5 of my roommates in Texas have separately called my cat fat, so y’all win.",austin,0,0
267,9,2020-08-04T03:13:26.000Z,"love people out loud, life is too short to keep it to yourself",austin,0,0
268,10,2020-08-03T18:05:41.000Z,WHY ARE ALL MY SHIRTS CROP TOPS,austin,0,0
269,11,2020-08-04T04:11:08.000Z,I really hope someone pick y’all one day ,austin,0,0
270,12,2020-08-04T03:36:02.000Z,I just want a lil boo haha,austin,0,0
271,13,2020-08-04T03:29:03.000Z,"descuide-conjunto nube
brings so many memories",austin,0,0
272,14,2020-08-04T22:59:21.000Z,"Yesterday for the first time I was recognized in public from just my voice by a listener lol 
@Twitter
 verify me :-)",austin,0,0
273,15,2020-08-03T13:32:27.000Z,I’m amazed in how many people are not willing to invest in proper tax planning that make well over six figures in their business and then complain about their tax bill #taxtwitter they’ll spend more money on things that bring no ROI before they invest in tax planning,austin,0,0
274,16,2020-08-04T23:18:46.000Z,I know how it seems..keep positive.,austin,0,0
275,17,2020-08-03T17:06:06.000Z,TXTag gone have to come find me before they get a dime.,austin,0,0
276,36,2020-08-04T14:03:11.000Z," start now and the next two weeks, some arguments are going to be arising with male figures in your life. best friend, brother, father. it seems like close male figures and it seems like it’s about serious situations. don’t scream don’t yell bc they have a valid point too.",austin,0,0
277,37,2020-08-04T13:12:34.000Z,GP is hard as hell on his players. He's a son of a gun on the field but he's not a racist at all. Life is far tougher than some of these kids believe TCU football is. GP is only getting them ready for what's ahead. The headlines are click bait. #IStandwithGP,austin,0,0
278,70,2020-08-03T19:54:48.000Z,"Once you make the conceious decision to never argue about musical legends (Beyoncé, Whitney, Michael, etc.) it makes it so much easier to laugh off/not engage with unfair criticism ",austin,0,0
279,71,2020-08-04T21:54:16.000Z,"$30 to rent a movie is absurd enough, but asking for you also subscribe to a streaming service to even have the ability to rent the movie is like another level",austin,0,0
280,72,2020-08-04T16:06:44.000Z,"what if it’s not that women are too emotional, it’s that most men lack emotional intelligence ",austin,0,0
281,73,2020-08-03T22:47:06.000Z,"Made a business email with my own domain name 
 loveeeeeee that for me",austin,0,0
282,74,2020-08-04T05:03:23.000Z,"it means nothing if you’re pretty with an ugly ass attitude, you win nothing",austin,0,0
283,75,2020-08-04T19:52:05.000Z,We’re 5 months into this pandemic and I still can’t find dumbbells anywhere.,austin,0,1
284,76,2020-08-04T23:20:32.000Z,Sada Baby highkey got the best music to workout to,austin,0,0
285,77,2020-08-03T22:20:36.000Z,"Companies claimed by Coronavirus:

Men's Wearhouse
Jos. A. Bank
Lord & Taylor
California Pizza Kitchen
Brooks Brothers
Chuck E Cheese
24 Hour Fitness
GNC
Hertz
J Crew
JC Penney
Neiman Marcus
Pier 1
Papyrus
Dean & Deluca
Fairway
True Religion
Roots USA

1/",austin,0,0
286,95,2020-08-04T00:21:51.000Z,"Cardi is collabing w Meg and I might pass out 
 ! I’m so excited",austin,0,0
287,96,2020-08-04T15:15:28.000Z,My wife just purchased a Ukulele randomly. If you hear some noise in any future streams that’s her playing hot cross buns ,austin,0,0
288,97,2020-08-03T15:17:47.000Z,"no one: 

8th grade kid wearing a deadpool shirt: you know you can make napalm from gasoline right??",austin,0,0
289,114,2020-08-03T07:48:08.000Z,"Seems many folks have completely abandoned facts for feelings and reason for rage.  There is something greater than us out there.  Whatever you choose to call It, It gave us free will.  We can use that free will to seek the truth or just run with our base instincts like animals.",austin,0,0
290,115,2020-08-03T05:49:53.000Z,Don’t pretend to be ok when you’re not ok,austin,0,0
291,116,2020-08-03T15:13:26.000Z,i can’t believe i sang the “it’s time to take a nap song” by doc mcstuffins 20 times while i was high and everyone encouraged it,austin,0,0
292,117,2020-08-03T14:53:16.000Z,If you've been in Austin for more than a week and don't know the Mounted Patrol doesn't play games I'm not sure you're going to make it.,austin,0,0
293,134,2020-08-04T16:08:18.000Z,"The feds act like selling weed is sooo serious but the fucking politicians have been selling children 
 oooowwwww",austin,0,0
294,135,2020-08-04T22:47:42.000Z,"8/4/20 #ATX hospital capacity #coronavirus update says:
-2,473 staffed beds at 71% capacity
-483 ICU beds at 78% capacity",austin,0,0
295,136,2020-08-03T18:23:14.000Z,"I’m doing just fine at doing things that don’t scale, thank you",austin,0,0
296,137,2020-08-04T23:41:18.000Z,I really miss new movies.,austin,0,0
297,155,2020-08-03T15:31:57.000Z,"My coworker just messaged me “you like fun, right?” On Microsoft teams im calling HR",austin,0,0
298,182,2020-08-04T02:06:46.000Z,"Friendly reminder, south Austin:

Tomorrow is trash day. Don’t forget to take your Dallas out to the curb",austin,0,0
299,183,2020-08-04T14:26:53.000Z,"reminder that you don’t have to be productive every single day. if your body is telling you to sit on the couch and binge watch new girl for 11 hours, DO IT. don’t burn yourself out. be kind to yourself",austin,0,0
300,184,2020-08-04T19:19:34.000Z,"Dropping a new EP collab with 
@d_dazmin
 this month!",austin,0,0
301,185,2020-08-03T15:51:03.000Z,how does instagram make anyone feel good?,austin,0,0
302,186,2020-08-04T18:04:59.000Z,I said MP today. Please clap.,austin,0,0
303,187,2020-08-04T16:39:55.000Z,A friend is driving my car to me in Texas so I can sit in it and cry.,austin,0,0
304,188,2020-08-04T19:46:51.000Z,Get me off 401k and relationship twitter please I just wanna laugh,austin,0,0
305,189,2020-08-04T22:45:52.000Z,"finally getting serious about pursuing vocal production. big things (hopefully) coming soon
 this is such a huge step for me i could cry",austin,0,0
306,190,2020-08-03T20:47:34.000Z,"thank you god for blessing me, i was able to get my loan access code so i’ll be on the hill for another year n then i was offered a full time position with POWER at a new warehouse thank you, thank you ",austin,0,0
307,191,2020-08-04T16:29:42.000Z,I quit my toxic full-time job last month. This August I start a new path in life. Working two part-time jobs and being devoted to writing and reading full-time. I’m privileged in so many ways still and I couldn’t be happier to sit here in my kitchen this morning and write.,austin,0,0
308,192,2020-08-03T16:19:27.000Z,"I just read this quote and it said. “If you think it’s bad now, In 20 years are country will be run by people who were homeschooled by day drinkers” ",austin,0,0
309,213,2020-08-03T23:16:05.000Z,I actually passed French 2.. I cannot believe this,austin,0,0
310,214,2020-08-04T16:26:30.000Z,"So yesterday my face decided to pick a fight with the wall of my parents’ pool.

I regret to inform everyone that the pool wall remains undefeated.",austin,0,0
311,215,2020-08-04T15:10:11.000Z,"America's economic recovery cannot succeed if Congress allows the #childcare industry to fail. I'm calling on 
@SenTedCruz
 to #savechildcare and ensure the final COVID-19 package includes more than the $15 billion included in the recent Senate package. #SuccessBy6ATX #EarlyMatters",austin,0,0
312,216,2020-08-03T20:35:44.000Z,So got some SUPER AWESOME news guys! As I was jamming tunes and getting ready for work I got the phone call that one of the bar backs tested positive for COVID and we're shut down until everyone gets tested....,austin,0,0
313,236,2020-08-04T22:05:01.000Z,I hate watching people waste food for a joke.,austin,0,0
314,237,2020-08-03T19:32:08.000Z,"#IStandByEllen bc that’s where she told me to stand so she didn’t have to look at my “stupid, gay face”",austin,0,0
315,238,2020-08-04T23:12:59.000Z,Not me getting a loaf pan so I can hit the bread making point of depression.,austin,0,0
316,239,2020-08-04T20:57:31.000Z,Sick of the sun. Might buy a black parasol in protest.,austin,0,0
317,259,2020-08-04T23:28:50.000Z,Bedrock was the best collab YMCMB gave as a collective collab,austin,0,0
318,287,2020-08-04T16:42:42.000Z,"Started to watch #ImmigrationNation last night and within the first couple of minutes, I was livid. FUCK ICE. FUCK TRUMP",austin,0,0
319,288,2020-08-04T17:19:25.000Z,"“If you want the thing, do the thing. Adults are like, no, no way I’d take the test right now, but you want kids to?!!! What?! No. Full stop right there!” 
@akilbello
 has left the room...
  #HackTheGates #testoptional",austin,0,0
320,289,2020-08-03T01:06:05.000Z,"Just watched ""Palm Springs"" on 
@hulu
. Fantastic film and wouldn't expect any less from 
@thelonelyisland
.",austin,0,0
321,290,2020-08-04T16:44:08.000Z,"I walked into an appliance store and bought a washer and dryer within 5 minutes and paid in full, I aint playin no more ",austin,0,0
