,Unnamed: 0,date,contents,city,city_in_disaster,target
322,291,2020-08-03T16:54:11.000Z,"Life comes at you full circle. When I was 15 my high school Dallas Madison got the chance to see the premiere of Gridiron Gang which starred 
@TheRock
 

15 years later... I get to cover a league owned by him and his business partner 
@DanyGarciaCo",austin,0,0
323,292,2020-08-03T20:20:50.000Z,No member of congress should collect a pay check as long as their are Americans who are not getting unemployment benefits because they can’t come up with a compromise. Ridiculous,austin,0,0
324,293,2020-08-04T19:26:12.000Z,I’m not sure what age you’re supposed to stop receiving birthday checks from your relatives by apparently 26 ain’t it. ,austin,0,0
325,294,2020-08-04T00:59:38.000Z,"Did I give myself a 30 min crying break today? You bet I did. It hit me today that we’re *still* in a pandemic with no end in sight and I just couldn’t hold it together. 

So, if you’re going through it, know this – you’re not alone.",austin,0,0
326,295,2020-08-03T15:52:43.000Z,"Alaina and I are spending three days by ourselves later this week as we celebrate our anniversary. When she asked me what I want to do I unintentionally said “drink food.”

I’ve never been more on brand. ",austin,0,0
327,296,2020-08-04T05:55:53.000Z,"If you’re looking for a great form of escapism, I *highly* recommend getting very stoned with your friends, whipping out a guitar, & playing old worship songs and Mumford & Sons",austin,0,0
328,315,2020-08-04T21:33:46.000Z,"Thank you 
@TonyKhan
!!!! You keep proving everyone wrong.",austin,0,0
329,316,2020-08-03T23:28:21.000Z,People really be moving funny...,austin,0,0
330,317,2020-08-04T02:09:37.000Z,"shopping for a new gas range, a lot of them WiFi support now... where did we go wrong as a society... is there a retailer that specializes yet in things that aren’t connected to the internet?",austin,0,0
331,318,2020-08-04T20:07:34.000Z,"IBM gave me an on-site interview when I was in college. I was so excited.

A few weeks later I hear classmates talking about their travel plans so I email the recruiter. That’s when they decided to tell me they changed their mind. So ya I’ll never work there.",austin,0,0
332,338,2020-08-03T20:37:50.000Z,I'm going tomorrow to get my test. Timing couldn't be more perfect considering I'm supposed to go to Portland in 10 days then also moving less than two weeks after I get back. Ftw....,austin,0,0
333,339,2020-08-04T17:05:16.000Z,Had a nightmare that a*y sch*mer made me a Bloody Mary in a watermelon,austin,0,0
334,340,2020-08-04T16:34:10.000Z,"all morning, my brain has simultaneously been plotting my lij betrayal zine and a ds9 fanfic while “forty-six and two” by tool plays in the background and i’m trying to work",austin,0,0
335,341,2020-08-03T16:41:52.000Z,"Starting a thread of videos and stat lines of those who have been consistently taking LESSONS at 
@Hitforth
 ... pretty electric stuff.",austin,0,0
336,360,2020-08-03T22:05:28.000Z,"Bout to become a middle-aged dad and buy one of those glasses bungees, like the kind you'd see on a fishing trip, because my glasses fall down so frequently when I wear a mask. ",austin,0,0
337,361,2020-08-04T17:21:01.000Z,That full moon energy.. whew,austin,0,0
338,391,2020-08-03T15:41:13.000Z,"#NursesKeepGoingNews, 
@shanimaven
, 
@lkbootman
, 
@ohjasminee
, 
@ChloeQween
 and I have received over $17,000 in donations to send nurses new sneakers. 

When I started this, my goal was $750 for 10 pairs... 
 
“You mustn’t be afraid to dream a little bigger, darling.” -Inception",austin,0,0
339,392,2020-08-04T13:45:32.000Z,"“If you aren’t embarrassed by your old work, you aren’t growing.” 

That’s what I’m telling myself this morning as I go back and read/watch some of older talks and trainings. 

Oof.  

Who’s with me?",austin,0,0
340,393,2020-08-04T04:56:03.000Z,Thanks for hanging last Friday! See ya soon UK and Europe friends... Friday set is gonna be way different!,austin,0,0
341,394,2020-08-03T14:01:04.000Z,I have a crazy amount of Richards in my life. Thinkin’ about that this morning.,austin,0,0
342,395,2020-08-04T02:16:52.000Z,Why are my titties not in someone’s sons mouth rn... truly ghetto I hate it here,austin,0,0
343,396,2020-08-04T12:19:54.000Z,Umbrella Academy going kraxy rn ,austin,0,0
344,397,2020-08-04T15:28:11.000Z,One of the wildest pitches I’ve ever seen involved cofounders who were in a relationship and tanked the pitch so badly it was clear they were gonna be broken up after it,austin,0,0
345,398,2020-08-04T18:06:46.000Z,Large opportunity this evening. I appreciate any and all prayers/intentions placed into the universe.,austin,0,0
346,0,2020-08-03T16:50:03.000Z,"Under the radar thought here, but what about Tulsi Gabbard for Biden's VP pick? Thoughts?",moore,0,0
347,1,2020-08-03T17:34:31.000Z,Does anyone know where I can purchase happiness? And how much does it cost?,moore,0,0
348,2,2020-08-04T22:34:42.000Z,Stuck between “I’m already 22” and “I’m only 22”,moore,0,0
349,3,2020-08-03T10:25:06.000Z,The biggest SCAM is working 40 hours a week to barely make ends meet,moore,0,0
350,4,2020-08-04T20:53:51.000Z,All I want is to cuddle in a cold bed,moore,0,0
351,5,2020-08-04T02:09:45.000Z,do u ever just hangout with someone for the first time and you’re like .... holy shit i love everything about your vibe and soul,moore,0,0
352,6,2020-08-04T21:09:40.000Z,you do not deserve the satisfaction of getting under my skin and making me act out of character.,moore,0,0
353,7,2020-08-03T16:41:19.000Z,Officially got accepted for the vaccine trial ,moore,0,0
354,8,2020-08-03T17:05:46.000Z,i wonder a lot where all my money would go if i didn’t have horses.... like do i invest in clothes then??? vehicles??? drugs???? friends?????? what do normal people blow their money on,moore,0,0
355,9,2020-08-03T16:27:21.000Z,"I’m at MHS helping Aubrey set up her classroom and this faculty member looks at us and asks if we need help finding our schedule for this school year. 

SIR??",moore,0,0
356,10,2020-08-04T03:19:54.000Z,Girl now I got lesbians hittin on my man it’s supposed to be a safe zone,moore,0,0
357,11,2020-08-04T01:51:38.000Z,I just remembered Pita Pit and I really miss it.,moore,0,0
358,12,2020-08-04T04:47:15.000Z,Like this tweet if you’re a “look at the moon” type person,moore,0,0
359,13,2020-08-03T20:58:13.000Z,downloaded instagram again and what do you know ! still performative !,moore,0,0
360,14,2020-08-04T02:33:06.000Z,its the boba place 5 min down the road from where i live for me,moore,0,0
361,15,2020-08-03T01:40:28.000Z,"Sky, Schmitty, and I were cruising around OKC and this homeless vet was yelling at this one dude for whipping it out and peeing on a tree. 

Gotta love the city life mannnn.",moore,0,0
362,16,2020-08-04T20:32:42.000Z,i’m so over checking on people who can’t ever just check on me for once,moore,0,0
363,17,2020-08-04T12:04:34.000Z,"The more you give, the more you live.",moore,0,0
364,18,2020-08-04T04:24:13.000Z,excedrin pm really said “you can’t have a migraine if you’re passed out for 12 hours straight!!!!!”,moore,0,0
365,38,2020-08-04T23:28:11.000Z,First few minutes of #ImmigrationNation and all I can think is #AbolishICE !!!,moore,0,0
366,70,2020-08-04T17:29:20.000Z,"The world is so evil it’s devastating. PRAY FOR LEBANON 
 #Lebanon #Beirut",moore,0,0
367,71,2020-08-04T16:36:13.000Z,Omg please someone help me find another job I am just about at my wits’ end at this place,moore,0,0
368,72,2020-08-04T22:44:01.000Z,There’s a 711 in Oklahoma City and a Turkey Creek in Olustee I’ve never felt closer to home lmao,moore,0,0
369,73,2020-08-04T17:34:24.000Z,Seeing health professionals walk into businesses in full scrubs but no mask,moore,0,0
370,74,2020-08-04T14:28:47.000Z,I share tweets w my cuz thru text bc she don’t have Twitter only to find out she posting what the tweets say on Facebook. What a comedian,moore,0,0
371,75,2020-08-03T14:45:04.000Z,The story of my life: trying not to cry in this Firestone Tire right now,moore,0,0
372,76,2020-08-03T04:26:19.000Z,"#LongliveSando 
 I love you bro!",moore,0,0
373,77,2020-08-04T15:28:45.000Z,I feel like I spent more time preparing for college speech presentations than the president spends preparing to address the country and it really shows. #yosemite,moore,0,0
374,78,2020-08-03T19:55:17.000Z,"I haven’t posted an update on my gofundme in awhile! With a few donations outside of Gofundme I am sooooo close to my halfway mark, which is honestly so mind blowing and remarkable in itself. Thanks again to everyone who has shared and donated!",moore,0,0
375,79,2020-08-03T15:43:10.000Z,Girls talk about driving and listening to music for dates but look at me like I’m crazy when I start belching out Bleeding Love by Leona Lewis?,moore,0,0
376,80,2020-08-03T03:17:12.000Z,every time i go see my parents in edmond there’s a road being widened to four lanes and a neighborhood with some stupid name being built,moore,0,0
377,102,2020-08-03T20:06:44.000Z,Did Golden Phoenix/Chinatown catch fire again?,moore,0,0
378,103,2020-08-04T21:45:27.000Z,ask -> me <-  if you have a question ab -> me <-,moore,0,0
379,104,2020-08-04T14:11:40.000Z,"Is it just me, or do a lot of people that claim to be “woke” have really just been had?",moore,0,0
380,124,2020-08-04T22:28:59.000Z,finally watched parasite and it was very good.,moore,0,0
381,125,2020-08-04T01:50:24.000Z,"#90DayFiance 
@90DayFiance
 #90dayfianceTheOtherWay The only way Biniyam and his ex’s dance routine could’ve been more awkward is if they had done molds of each other‘s breasts and then put sequins on them.",moore,0,0
382,126,2020-08-04T11:48:51.000Z,"-I’m told B12 expected to announce Sep.19 or 26 as conference start date. 

-OU wants to play non-con game 2 weeks prior to B12 start date, thus...

If B12 start date 9/19....OU opens 9/5 vs Mo State

If B12 start date 9/26...OU opens vs Mo State (or replacement opponent) 9/12...",moore,0,0
383,145,2020-08-04T00:07:27.000Z,idk why but i am not feelin myself lately,moore,0,0
384,146,2020-08-03T22:56:17.000Z,when u guys have anxiety rlly bad does it feel like there’s a rollercoaster in your chest and stomach orrr just me,moore,0,0
385,147,2020-08-04T01:58:34.000Z,Do you check multiple times to make sure your alarm is set or are you normal?,moore,0,0
386,177,2020-08-03T06:43:17.000Z,I can make your monday’s even better like the weekend,moore,0,0
387,178,2020-08-03T17:36:57.000Z,Imma be honest man anyone who doesn’t like country music is a straight KNOCK. what’s wrong w you??,moore,0,0
388,179,2020-08-03T13:06:44.000Z,"Good Thunder Morning OKC!  Game Time is 3pm CDT vs Nuggets in the Bubble, on Fox Sports OK.",moore,0,0
389,180,2020-08-04T20:01:12.000Z,No time to fuck around are you trying to be my cornhole partner at my family events or no. If you are a sensitive person you don’t need to apply my family will indeed make you cry,moore,0,0
390,181,2020-08-04T00:55:36.000Z,a little kid ask me if I had any kids and I said “not yet but i’m not sure if I want to have any” and she said “just adopt! that way everyone wins!” which seems smart,moore,0,0
391,182,2020-08-03T02:58:47.000Z,"My grandmas password is M and her wallpaper is 
@notmichellevsco
 ... guess who’s the favorite",moore,0,0
392,183,2020-08-04T21:19:35.000Z,"Mannnn some of y’all need to realize that if someone wants to walk out of your life, you need to let them.

Y’all fr be hurting your own feelings over someone who doesn’t care about you. Let em go.",moore,0,0
393,184,2020-08-04T00:17:52.000Z,lord the coochie you gave me be putting me in situations ain ask to be in ,moore,0,0
394,185,2020-08-04T13:05:39.000Z,"Pandemic silver linings: Riding to and from work lately, I now frequently pass an elderly neighbor who stands on her sidewalk and waves at me with all the joy of a kid watching the Rose Parade.",moore,0,0
395,204,2020-08-04T20:28:15.000Z,put in my two weeks at target and they took me off the mf schedule this week lmao,moore,0,0
396,205,2020-08-04T00:47:08.000Z,Nothing makes you feel older than using the phrase “back in college...”,moore,0,0
397,206,2020-08-04T23:37:34.000Z,"Pretty soon, I get to be a member of Twitter’s most over-represented demographic: angsty grad students",moore,0,0
398,207,2020-08-03T04:55:26.000Z,Who’s watching the Thunder game in OKC tomorrow tomorrow?,moore,0,0
399,208,2020-08-03T16:31:41.000Z,"And my daughter looks exactly like her daddy of course. 
 @sammithaghoul
 you’re lucky I think you’re the cutest person on the planet lol",moore,0,0
400,228,2020-08-04T22:50:08.000Z,I miss my family in Mexico so much..I would literally do anything to go see them again ,moore,0,0
401,229,2020-08-04T00:43:39.000Z,"The problem is stop trying to find someone to grow old with, I wanna find someone to stay a child with and be goofy.",moore,0,0
402,230,2020-08-03T23:18:31.000Z,"I sent 4 emails today 
 and was tired 
 I’m not ready for RA training nor starting class ",moore,0,0
403,231,2020-08-04T17:44:49.000Z,Aight I want to have a baby,moore,0,0
404,252,2020-08-04T03:09:40.000Z,If Bobby fr gets freed tomorrow 2020 is turning completely around and becoming the best year ever,moore,0,0
405,253,2020-08-04T11:41:37.000Z,Going to bed at midnight and waking up at 6:30? I am intrigued. I think I like it.,moore,0,0
406,285,2020-08-04T16:20:47.000Z,"I was mowing this morning and a lady was walking up to my porch with a flyer, so I cut the mower and she said “Aw, no sweetie you don’t have to stop. I’m just gonna leave this on the porch for your parents”",moore,0,0
407,286,2020-08-03T03:29:24.000Z,"I just realised I was in Atlanta and forgot to post “Peace up, A-Town” and I don’t think I’ll be able to sleep tonight.",moore,0,0
408,287,2020-08-04T13:03:52.000Z,why do these dudes get with beautiful ass women that they know are out of their league just to cheat on them with a 4 it will never make sense to me.,moore,0,0
409,288,2020-08-03T15:01:47.000Z,Create an environment where you feel inspired and witness examples of excellence. #focus,moore,0,0
410,289,2020-08-03T16:30:51.000Z,"If it were up to the fans, Billy Donovan wouldn’t even be OKC’s coach this year. 
 I didn’t forget how y’all were talking a year ago.",moore,0,0
411,290,2020-08-03T17:53:46.000Z,"I’m beginning to accept the fact I’ll be spending the rest of the year in quarantine, if not longer. This shit sucks.",moore,0,0
412,291,2020-08-03T04:13:01.000Z,I have to go back to work on campus tomorrow and just ,moore,0,0
413,292,2020-08-04T14:38:28.000Z,I’ve had to take Oliver to a few doctor appointments by himself lately. Do you know how often I check I didn’t accidentally bring Logan AFTER I arrive? Never before. Always after.,moore,0,0
414,293,2020-08-04T04:48:35.000Z,dropped a boy off at his place after we hooked up and he told me he ate McDonald’s and taco bell today and I said “and you still bottomed?” and he shook my hand then got out of the car,moore,0,0
415,294,2020-08-04T00:26:26.000Z,In high school my senior year calculus teacher said to me all native Americans are drunks trying to steal white peoples money through casinos,moore,0,0
416,315,2020-08-03T14:06:56.000Z,The XFL was only worth 15 Million? Hell Sam Darnold’s net worth is more than 15 Million. ,moore,0,0
417,316,2020-08-04T01:41:00.000Z,This chick I’ve had on snap for awhile finally made a OF and she asked me if “I wanted the link” to it and I said “for what” and she deleted me lmfaoooooo,moore,0,0
418,317,2020-08-04T03:42:30.000Z,I’m trying to stop being mean but it’s like y’all have to stop being stupid first,moore,0,0
419,318,2020-08-04T13:38:28.000Z,"Ung kaklase mo sa HS na may tanong. “Diba may pera kana? Bat di ka bumili ng pampaputi? Morena ka parin.”

So what’s wrong with my morena skin? My Skin is Fcking Beautiful. Legit na makinis at hindi alagang gluta. And many people here in the US would pay money to have ths skin.",moore,0,0
420,339,2020-08-03T17:31:26.000Z,"OKC Twitter -

Where can I find a savory pie? I have checked 2 German bakeries with no luck!",moore,0,0
421,340,2020-08-03T03:53:59.000Z,"There are some moments on Twitter when the politicos are less active and my writing friends shine through. One day, I will get back to being an author, when the world is safe. In the meantime, vote for Dems like your life depends on it. Because it does.",moore,0,0
422,341,2020-08-03T22:54:54.000Z,If CP3 would’ve just hit the damn free throw ,moore,0,0
423,360,2020-08-04T22:18:08.000Z,My 6% package got here in like 3 days,moore,0,0
424,361,2020-08-03T14:23:46.000Z,"I’m not a t swift kind of girl, but betty.. makes.. my heart...race???",moore,0,0
425,362,2020-08-04T03:54:44.000Z,My girl has me doing full moon cerimonies I hope she sacrifices me,moore,0,0
426,393,2020-08-03T04:17:38.000Z,I’m dreaming in photoshoots and development chemicals,moore,0,0
427,394,2020-08-04T21:59:16.000Z,"i’m 15 minutes into the axios interview and i’m ready to call it and let 
@jonathanvswan
 be president now.",moore,0,0
428,395,2020-08-04T21:38:34.000Z,"One of my top ten wishes is that 
@Brian_Pelts
 would get an iPhone so my tapbacks will resonate in a more immediate way.",moore,0,0
429,396,2020-08-04T23:51:19.000Z,"I have learned some things today, friends. Bigly things. 

Things I leaned today:

(1) the toilet seat at my house has been painted

&

(2) tilex basically melts away paint 

/end",moore,0,0
430,397,2020-08-04T01:38:58.000Z,I retweeted ONE CURSED THING and LITERALLY EVERYONE started to have conversations in my mentions EVEN THOUGH I SAID NOTHING. If you cannot take people out of the reply thread AND SHOW SOME DAMN RESPECT then get off Twitter YOU KNUCKLE DRAGGING MOUTH BREATHERS.,moore,0,0
431,398,2020-08-04T22:10:42.000Z,don’t let them guilt your ambition.,moore,0,0
432,399,2020-08-04T04:43:10.000Z,"me apreciating my gf for making me boba 
my ass knowing damn well she used half and half ",moore,0,0
433,400,2020-08-04T12:39:04.000Z,Great morning world !!,moore,0,0
434,401,2020-08-04T12:31:21.000Z,"I'm so busy loving my life that I have no time for hate, regret or fear.",moore,0,0
435,420,2020-08-04T03:37:51.000Z,"Updated OU scheduling info on Tuesday morning’s “T-Row Show” on 
@Sportstalk1400
 (6-9am). Likely dates of season opener and B12 opener and more.",moore,0,0
436,421,2020-08-03T03:15:00.000Z,"“These virtual fans for Houston... they showed up for their team.”
-NBA Announcer, in August.

Imagine hearing this in 2019.",moore,0,0
437,422,2020-08-04T12:06:16.000Z,Facebook school-opening opinions is not what I needed to wake up to this morning.,moore,0,0
438,423,2020-08-04T18:27:00.000Z,"Loved discussing the simple view of reading, dyslexia, DLD, and SLD evals today with 
@MoorePublicSch
 school psychologists! 

We also had fun with 
@spelfabet
’s predictable texts! Let’s keep sowing seeds of the #scienceofreading.",moore,0,0
439,0,2020-08-04T13:42:46.000Z,The United States sold fake dreams to immigrants.,boston,0,0
440,1,2020-08-04T12:38:50.000Z,"Mars in Aries squaring Jupiter in Capricorn can bring us luck, strength and courage today if we don’t go overboard. #astrology",boston,0,0
441,2,2020-08-04T02:13:37.000Z,The fossil fuel companies are on #TeamKennedy because Kennedy is an oil candidate,boston,0,0
442,3,2020-08-03T13:48:17.000Z,Being commissioned is the best feeling in the entire world ,boston,0,0
443,4,2020-08-04T12:11:31.000Z,"So excited to be joining the talented team at 
@GtownCHIR
! Thanks to everyone for a *virtual* warm welcome on my first day. Ready to dive into these important issues!",boston,0,0
444,5,2020-08-04T14:59:33.000Z,"When you criticize an elected and it hits so deep that they unfriend you rather than engage, it means you are absolutely right, and probably so right that they don’t want others to catch on.",boston,0,0
445,6,2020-08-04T13:57:32.000Z,Trynna be a better person everyday,boston,0,0
446,7,2020-08-04T15:00:54.000Z,"The difference between 
a BOY and a MAN. 

B.O.Y(Burden On You) 
M.A.N(Meet All Needs) 

Know The Difference",boston,0,0
447,8,2020-08-03T23:29:59.000Z,my baby sister just graduated and Ms. Rona  said I can’t go to the ceremony ,boston,0,0
448,9,2020-08-04T15:49:56.000Z,unfortunately for everyone i will continue existing,boston,0,0
449,10,2020-08-04T02:24:44.000Z,"Today I had my first iVats where I got to use the stapler for the wedge, then I went on a lung procurement where I go to open the chest. I did the sternotomy and more!!! 
 No one on twitter can top my day 
#whybwhi6CTsurgery 
@BrighamThoracic",boston,0,0
450,11,2020-08-04T22:28:58.000Z,Feeling salty about being accused of making a land grab during a pandemic. Guess what? You’re making a land grab during a pandemic. Don’t want to feel salty? Don’t ignore kids and community—the ones who actually use the land—in the plans you create. #bospoli,boston,0,0
451,12,2020-08-03T01:44:23.000Z,y’all really hate black women cause why is there a petition for noname to get therapy?! ,boston,0,0
452,13,2020-08-04T12:38:46.000Z,Communications become more direct and bold today with an emphasis on self-expression as Mercury enters the sign of Leo. #astrology,boston,0,0
453,14,2020-08-04T13:10:12.000Z,"Right to Counsel is great and important but ultimately it is a bandaid solution that fails to address the root of the problem 

“We’re going to push you into into the deep end but don’t worry, we’ll make sure you have a pool floatie when you get there”",boston,0,0
454,15,2020-08-04T03:11:05.000Z,"Tip for all my gaming people:

Be picky on who you play video games with, people who throw the vibe off, or you struggle to find chemistry with are going to hinder you game and content. 

Even if you love the person irl, you have to draw a line somewhere.",boston,0,0
455,32,2020-08-04T06:17:50.000Z,tweeting & realizing don't nobody care >>>>,boston,0,0
456,33,2020-08-04T15:06:58.000Z,"On mommy we don’t deserve 
@AOC",boston,0,0
457,34,2020-08-03T00:54:26.000Z,"Just saying, I can’t think of any job where I could miss 80% of the time and still work there. Or any place I could spend only 38% of my time and still say I live there. The U.S. Senate, and Massachusetts, should have higher standards. Vote 
@joekennedy
 on September 1st.",boston,0,0
458,52,2020-08-04T20:48:04.000Z,Praying for Lebanon ,boston,0,0
459,76,2020-08-04T18:03:53.000Z,"The Truth About Healing:
being a divine feminine is beautiful but hard because you had to do a tremendous amount of shadow work, lose people you love, lose jobs & opportunities, lose money, lose your MIND (literally and spiritually) and feel lonely to reach empress status and",boston,0,0
460,77,2020-08-04T18:09:53.000Z,Some men need to learn that not every girl they talk to they have to get at them romantically or intimately. You can have a platonic relationships with women as well.,boston,0,0
461,78,2020-08-04T21:45:58.000Z,"You put someone’s life in danger for YOUR FUCKING NAILS????

I hate people",boston,0,0
462,79,2020-08-03T17:30:59.000Z,Psssst. You can get COVID-19 in affluent white suburbs. Pass it on.,boston,0,0
463,80,2020-08-03T16:50:30.000Z,"Found out abt a job w impending deadline & my mentors, PD & Chair dropped everything to help complete my app. Never before have I felt so believed in... & got an interview I didn’t think I had a chance at! That is sponsorship & so grateful to have this at @BostonCityEM #WhyBMCEM",boston,0,0
464,81,2020-08-03T17:41:59.000Z,I successfully detangled 2 extension cords today without freaking out this is HUGE for me,boston,0,0
465,82,2020-08-03T01:17:45.000Z,"My preferred pager etiquette:
Pt name, MRN, (room # if urgent) pertinent data, consult question/concern. Contact name and call back (cb) #. 

Bonus points for staying at cb# for 5 min, 2x bonus for cellphone.

Least fav:
- room # + request only, no cb#
- cb# only

What's yours?",boston,0,0
466,83,2020-08-04T01:53:06.000Z,God says “ feeling weary and heavy burden? come to me and I will give you rest.” Matthew 11:28-30,boston,0,0
467,84,2020-08-04T20:11:47.000Z,"I said to a client today, “I’ll give you a call tomorrow morning and we will see what we can make shake!” And I’ve never hated myself more.",boston,0,0
468,101,2020-08-04T13:57:22.000Z,Stop determining your self-worth based off of your work.,boston,0,0
469,102,2020-08-03T18:45:04.000Z,"So, if I rename all the church committees “ministry pods,” will that make me nimbly missional?",boston,0,0
470,103,2020-08-04T23:50:23.000Z,i love jackie bradley jr. which you all know. but i’m reiterating.,boston,0,0
471,104,2020-08-04T00:08:32.000Z,"I have been watching wrestling and WWE for the past few weeks and WOW.

The DRAMA. The PASSION. The ATHLETICISM. The TIGHTS!!!!",boston,0,0
472,122,2020-08-04T04:39:34.000Z,Gonna get cancelled for being a class traitor because I spent $10 on pink bullets in Call of Duty,boston,0,0
473,123,2020-08-04T22:24:32.000Z,Thank you to those who have reached out and asked about my family. They’re all safe but certainly shaken. Today was an unpleasant scare #BeirutBlast,boston,0,0
474,124,2020-08-04T18:45:40.000Z,"Go For Geary tonight at 6. Ready your calls. Any and all topics. 
508-964-3527",boston,0,0
475,125,2020-08-04T20:52:15.000Z,Get money & mind ya business,boston,0,0
476,143,2020-08-04T23:46:34.000Z,"I thought the phrase was “Hell or high water “ not “hell AND  high water.”  Enough, 2020.",boston,0,0
477,144,2020-08-04T22:09:16.000Z,"I could tweet that I want a facial from 49 men. Unless you were one of the 49 men I am specifically addressing, there’s no need for private discourse surrounding my public tweet",boston,0,0
