,date,contents,city,city_in_disaster
75,2020-12-24T21:06:40.000Z,One of the best things about getting sober is re-binging some TV shows that I vaguely remember. #OZARK,austin,0
76,2020-12-25T03:24:02.000Z,"So many beautiful families out there today, a lot of y’all look fresh af too. Merry Xmas guys ",austin,0
77,2020-12-24T01:47:35.000Z,"My brother has been Christmas shopping ALL DAY and the anxiety in me just could NOT. I hate shopping to begin with, but all in the crowds of people??? Hell no",austin,0
78,2020-12-25T04:04:44.000Z,"I was off for a week because I was sick and I had a table of UPS employees today leave me a $60 tip. I almost cried. Merry Christmas Eve, everyone. But especially to them.",austin,0
79,2020-12-24T15:48:37.000Z,The key to good bbq is not sleeping for more than 90 minute stretches for 12-24 hours,austin,0
80,2020-12-25T18:22:42.000Z,"A Jew on a bike ride saying Merry Christmas 
 to every walker out this morning",austin,0
81,2020-12-24T03:00:51.000Z,"BEST HOLIDAY NEWS EVER!!! My parents are getting vaccinated Saturday!!!!!! 
 god is good! ",austin,0
102,2020-12-25T20:34:21.000Z,honestly a man telling me he wants a baby with me is not enough for me to actually give him a baby.,austin,0
103,2020-12-25T20:11:30.000Z,"Christmas just doesn’t feel like Christmas without little baby arms around me. I can’t wait for next year. 

I hope you all have a wonderful day.",austin,0
104,2020-12-25T23:03:12.000Z,"I have finally seen #WW84.
I cried. I fangirled. It was so so worth it.",austin,0
105,2020-12-24T05:37:55.000Z,"Trump’s next pardons will be for Ursula, Scar, and Jafar... and no question Gaston will also be included",austin,0
126,2020-12-25T15:04:39.000Z,"thankful for another day of life 
today was not given or promised 
blessed & highly favored",austin,0
127,2020-12-24T23:14:32.000Z,All I want for Christmas is a job that pays the bills. And a back scratching.,austin,0
128,2020-12-24T02:05:11.000Z,no one understands how bad i want to bleach my eyebrows,austin,0
129,2020-12-24T23:25:14.000Z,this exotic got me making a list and checking it twice,austin,0
130,2020-12-25T20:54:36.000Z,My dad told me congrats for making the chronicles top 100 local album list for 2020 with the second best project you released this year ,austin,0
179,2020-12-25T05:05:11.000Z,Everyone who has been to a party during this pandemic is gonna wake up with some coal in their stockings,austin,0
180,2020-12-25T20:32:47.000Z,Happy Birthday to the original Palestinian socialist king himself!,austin,0
181,2020-12-25T07:37:08.000Z,UMMM WHICH ONE OF YOU DONATED TO SPONSOR A CAPYBARA IN MY NAME?!?!?!?! AND THANK YOU????,austin,0
182,2020-12-25T06:31:04.000Z,making a big pot of gumbo for any of the latchkey homies that can't leave town and have nowhere to be for christmas hmu,austin,0
183,2020-12-24T23:10:40.000Z,Non-Jews of Twitter: Prepare yourselves for an inundation of Chinese food photos from your Jewish friends tonight,austin,0
184,2020-12-24T18:16:57.000Z,"My three settings
-Sci Comm 
-Baylor Girl 
-TRAAANNNNSSSS ",austin,0
185,2020-12-25T15:37:39.000Z,So my lil sister got a new fish last night and it committed suicide by jumping out the bowl ,austin,0
186,2020-12-25T20:14:32.000Z,"Merry Festivus, beat the fuck out of that one annoying family member.",austin,0
187,2020-12-24T16:13:52.000Z,"My grandpa had a heart attack Tuesday night and is having a quadruple bypass today, please send good vibes his way ",austin,0
188,2020-12-25T16:09:36.000Z,"Without ever talking about a shared appreciation of his work 
@beckycloonan
 and I randomly gave each other Naoki Ursawa books. We truly are one being!",austin,0
189,2020-12-25T17:09:16.000Z,"It’s not Christmas until you’ve received all 3

1. The xmas chain texts 
2. The team snapchat Xmas snap
3. Your grandma’s 3 part aggressively Christian Xmas green text to you and all the random numbers",austin,0
209,2020-12-24T17:50:03.000Z,"Now that the #RWF is coming to an end, I just wanted to give a BIG shoutout to both 
@bigdumbgaming
 and 
@OTKnetwork
! Casting for both orgs was a blast and I had such a fun time. Big props to everyone both on screen with me and behind the scenes!! Y’all made this race AMAZING ",austin,0
210,2020-12-24T17:40:00.000Z,I'm adopting a senior dog when I move in Feb and I just found out that my apartment removed their weight restrictions- about to get a big ole boy,austin,0
211,2020-12-25T00:51:14.000Z,"Anyone who ever doubted me, talked down, or did me dirty. Thank you. Your the reason I’m the one",austin,0
212,2020-12-24T19:10:16.000Z,Anyone else feel like such a GRINCH this Christmas ?,austin,0
232,2020-12-25T04:06:09.000Z,Merry Christmas folks! May your God bless you and yours ,austin,0
233,2020-12-25T02:25:05.000Z,"Josh Bell isn’t a very good baseball player. I don’t think that trade is bad for Pittsburgh. Could they have gotten more? Maybe. But Josh Bell has had one good season and has been replacement level the rest of his career. Only 28, the hit tool is there, but he’s not a star player",austin,0
234,2020-12-25T19:59:52.000Z,"a little tipsy, bout to send the WYD text to the man in my apartment",austin,0
235,2020-12-25T08:01:25.000Z,Rhode Island is the San Antonio of New England,austin,0
255,2020-12-25T17:27:54.000Z,not me feeling shaky because of my morning coffee. all this caffeine and nowhere to direct the energy.,austin,0
284,2020-12-24T19:26:16.000Z,My family would change Christmas to Sunday when I’m scheduled to black out Saturday...,austin,0
285,2020-12-24T17:40:00.000Z,meagan you do not have to do the mean girls jingle bell rock dance every time the song comes on. you don’t.,austin,0
286,2020-12-25T22:33:22.000Z,"We are gonna sign to a major deal 
God confirms ",austin,0
287,2020-12-24T08:37:44.000Z,Rush Limbaugh dying of cancer is getting in the way of my dream of seeing him devoured by wolves. There’s still time but honestly I see no path to victory ,austin,0
288,2020-12-24T19:41:13.000Z,Putting two comforters on our bed might be the best thing we ever did for our marriage,austin,0
289,2020-12-25T13:59:43.000Z,Happy “my child is an ungrateful brat” day! ,austin,0
290,2020-12-25T01:09:22.000Z,ps we’re watching muppet christmas carol,austin,0
291,2020-12-25T03:28:02.000Z,"So I decided to make 
@MrMake1tHappen
 baked Ziti and I’m annoyed! WHY IS IT SOOO GOOD?!  Like we over here licking bowls as if it’s our last meal. ",austin,0
292,2020-12-25T03:37:54.000Z,"missing 
@KrissieTX
. ready for her return to twitter!",austin,0
293,2020-12-24T18:29:25.000Z,"‘Twas the day before Christmas  
And on vacation at last
I sat down to read my student’s
dissertation draft   
Tho the semester has ended  
And classes complete
The work never ends  
in the old academe",austin,0
294,2020-12-25T18:01:52.000Z,I miss vine,austin,0
323,2020-12-25T18:14:04.000Z,Toulouse been boomin the past 2 weeks. It’s really starting to feel like old Toulouse days again.,austin,0
324,2020-12-25T04:36:13.000Z, to all the other parents out there assembling things all night!,austin,0
325,2020-12-25T07:48:11.000Z,I don’t wanna get microchipped when I get the vaccine. I wanna get macrochipped. Make that shit big,austin,0
326,2020-12-24T20:31:21.000Z,‘You don’t have to be what people want you to be because you’re a woman. Keep pushing. Be an asshole.’ I love my guy friends,austin,0
394,2020-12-24T00:20:08.000Z,"Anyone else having issues playing League Pass games on the 
@NBA
 app on Apple TV?",austin,0
395,2020-12-24T14:48:51.000Z,"I just want to say thank you to 
@splice
 and 
@discohq
 for being so gosh darn trusting and supportive of me and my writing. ",austin,0
396,2020-12-25T20:10:40.000Z,5 mimosas in. What’s up? ,austin,0
397,2020-12-24T16:50:11.000Z,"Wednesday 12/23 was the busiest day for air travel of the entire #COVID19 pandemic across the country and at 
@AUStinAirport
. 
@TSA
 screened 1.19 million at America’s airports and 13,205 in #Austin, a sign that the virus isn’t stopping all #Christmas2020 travel plans. ",austin,0
417,2020-12-25T02:17:14.000Z,Holiday szn Twitter used to be so fun b/c everyone was home for the holidays and off work so tweet volume went up and went more causal / relaxed but now we’re just all at home all the time anyways now lol,austin,0
0,2020-12-25T14:49:40.000Z,"PRESENCE> PRESENTS. Thankful for my family, Merry Christmas!",moore,0
1,2020-12-24T17:15:17.000Z,"#Sooners AP All-Big first team selections

QB Spencer Rattler
C Creed Humphrey
K Gabe Brkic 
DT Isaiah Thomas",moore,0
2,2020-12-25T01:58:35.000Z,You don’t have to understand the plan when you trust God has a purpose.,moore,0
3,2020-12-25T01:57:01.000Z,"Casserole in fridge.
Christmas Eve Hamburger Helper done.

I’m ready for a drink! Lol",moore,0
4,2020-12-24T22:54:17.000Z,"My biggest flex at 20 is that I’m not engaged, don’t have kids, and I’m single. The secret you may ask.. 
move away from your hometown and never go back",moore,0
5,2020-12-25T07:37:56.000Z,I just find it interesting that the kid in Polar Express is Logan Lerman,moore,0
6,2020-12-24T08:47:52.000Z,Christmas: where i can’t sleep for two days because I’m way too excited and anxious to see everyone & for them to open their gifts,moore,0
7,2020-12-25T20:10:38.000Z,When I say that I’ve never loved a movie as much as I love Soul... I’ve never loved a movie as much as I love Soul.,moore,0
8,2020-12-25T05:26:38.000Z,y’all say carti trash and ur fav rapper nba young boy.... byeeeee!!!!,moore,0
9,2020-12-25T00:28:15.000Z,I’ve literally been here for 30 minutes and I’m already pissed lmao. YOU DON’T HAVE TO STOP WHEN YOU’RE TURNING RIGHT BY RIVERWIND. that shit has been green for 15 years omg,moore,0
10,2020-12-25T18:04:45.000Z,A CUSTOMER LEFT ME AND MY COWORKER A JOINT AS A TIP HELLO,moore,0
11,2020-12-25T06:39:07.000Z,"bees can’t fly in rain. i, however, cannot sleep in pants. we all have our limitations, yall stay safe",moore,0
12,2020-12-25T16:55:37.000Z,I never feel more like a cog in the machine than when I have to speak in my customer service voice on Christmas,moore,0
13,2020-12-25T04:17:39.000Z,I’m so jealous ( but happy of course i really love to see it.)  of people who spend the holidays with their big families ,moore,0
14,2020-12-24T02:14:15.000Z,pls no more wind,moore,0
15,2020-12-24T04:18:24.000Z,No better tradition than buying Christmas presents 72 hours before Christmas.,moore,0
16,2020-12-25T22:27:32.000Z,"My mom just willingly and unprompted asked me a question about my synagogue 
Y’all. This is massive.",moore,0
34,2020-12-25T00:41:45.000Z,i got ashlee an espresso machine for christmas and gave it to her last night... i have had like 5 shots of espresso today,moore,0
35,2020-12-25T15:00:18.000Z,holidays be difficult w/ split family man,moore,0
36,2020-12-24T22:27:54.000Z,"my friend gave jr $100 for christmas, why this boy goes “ mom look up some plane tix” 
me: why? for what? 
* him waiving the money around 
“i got us
” 
literally winked too! ",moore,0
71,2020-12-25T16:05:33.000Z,"Merry Christmas, OKC!!! ",moore,0
72,2020-12-24T22:08:45.000Z,What has 2020 taught you?,moore,0
73,2020-12-25T14:07:56.000Z,"Another year, no pony.",moore,0
74,2020-12-25T17:46:11.000Z,Merry Christmas Twitter Fam,moore,0
75,2020-12-25T08:12:42.000Z,My home town smells like cigarettes and weed,moore,0
76,2020-12-25T03:23:56.000Z,"Eddie: You surprised to see us, Clark? 
Clark: Oh, Eddie... If I woke up tomorrow with my head sewn to the carpet, I wouldn't be more surprised than I am now.",moore,0
77,2020-12-25T21:44:51.000Z,My white dad and white grandpa having an extensive discussion in Cantonese while me and my Chinese mother are like ??? what are they saying ??? and my Aunt runs out of the room is a big and classic Wilson Christmas mood.,moore,0
78,2020-12-24T21:45:04.000Z,I’m still in disbelief that I got the chance to make an order for a basketball player and his wife who was miss universe..... ,moore,0
79,2020-12-25T02:11:57.000Z,“Can I refill your eggnog for you? Get you something to eat? Drive you out to the middle of nowhere and leave you for dead?”,moore,0
80,2020-12-25T22:15:23.000Z,got my girl a business for christmas.,moore,0
101,2020-12-24T16:58:14.000Z,"On this Christmas Eve, I’ve already taken two naps. Doing it right!",moore,0
102,2020-12-24T19:23:22.000Z,I know the ladies at McDonald’s are tired of seeing me this week,moore,0
103,2020-12-25T00:46:49.000Z,"Iowa State’s Breece Hall finished 6th in the Heisman voting 

Only Big 12 player in the top 10",moore,0
104,2020-12-24T02:40:33.000Z,"Used to dislike when my mom added onions to flavor hamburgers while cooking them, but look at me now, flavoring my hamburgers when I’m cooking them. ",moore,0
125,2020-12-25T06:13:46.000Z,"2020 was by far MY year... despite everything going on in this world, i accomplished so many things and had so many answered prayers.
God is SO good.",moore,0
126,2020-12-24T12:29:14.000Z,So ready to head up the interstate and head to Miami for my birthday today and Christmas tomorrow.,moore,0
127,2020-12-24T18:46:30.000Z,I hope to make Christmas a holiday that my children look forward to. It’s always been a day that I’ve dreaded because I’ve always felt like an intruder no matter where I’ve been. I look forward to making it special for my kids.,moore,0
128,2020-12-25T03:38:28.000Z,If Harden somehow ends up on the Blazers I'm not watching them until he leaves.,moore,0
149,2020-12-25T02:40:49.000Z,"Y’all...
 
I think I’m too tired to drink tonight.

Will try again tomorrow lol",moore,0
150,2020-12-24T11:20:48.000Z,things that hit different: anxiety nausea after getting anxious about the fact that you don’t know if you should be so anxious about something that you’re anxious about,moore,0
183,2020-12-24T19:58:32.000Z,will never forgive my brother for being a more controversial member of the LGBT community and stealing my spotlight at family gatherings,moore,0
184,2020-12-24T08:37:24.000Z,i tried to show the guy working the self-checkout my id while buying wine and he said “ur good! u come here enough” UMMMM thanks?,moore,0
185,2020-12-24T05:19:44.000Z,i knocked a plant over where my laundry basket normally is so i am now just throwing my laundry onto the pile of dirt on the floor,moore,0
186,2020-12-24T04:52:25.000Z,"I’m so sad we only have a few more days left to listen to Christmas music. 

Who am I kidding? I’ll prob listen at least until the the first 
 ",moore,0
187,2020-12-24T19:28:35.000Z,Get to spend the whole day with all four of my siblings. This about to be some real funny/petty shit ,moore,0
188,2020-12-25T18:27:37.000Z,let the bacon tell YOU when to flip it,moore,0
189,2020-12-24T06:59:53.000Z,"Dammit Jim, I'm a doctor, not a ________ (Use the middle suggested words to complete this sentence)

Dammit Jim, I'm a doctor, not a good idea.",moore,0
190,2020-12-24T08:03:09.000Z,I think being apart of a basketball team that hit a buzzer beater and then runs to the locker room immediately as a group is a top-3 sports thing that really isn’t apart of the sport that I’d love to do,moore,0
191,2020-12-24T20:17:41.000Z,I haven’t gotten to watch Love Actually this year and I think that’s why I can’t quite get into the Christmas spirit :/,moore,0
210,2020-12-25T21:16:16.000Z,"Me review of the new Wonder Woman?

I’m glad I didn’t pay money to see it in theaters. ",moore,0
211,2020-12-25T12:52:52.000Z,Merry Christmas to all my family and friends remember Jesus is the reason and this country needs him more than anything today!,moore,0
212,2020-12-24T18:28:10.000Z,Being put to the test. Making a breakfast casserole that Markus’s grandma has made for many years for Christmas morning. Pray I don’t fuck it up.,moore,0
213,2020-12-24T20:44:46.000Z,"Which one taste better ?? 
@littlecaesars
 @MyCicis
 help us resolve this ! ",moore,0
232,2020-12-24T18:27:26.000Z,"Thankful that I learned how many people I’ve surrounded myself with who mean me harm, or at the least don’t mean me good. Thankful that I saw how I allowed my personhood to be taken away from me to fuel others desires and machinations.",moore,0
233,2020-12-24T08:24:26.000Z,hospitals won’t let you see your dying loved ones because of covid but bars and malls are open. i see where america’s priorities stand,moore,0
234,2020-12-25T18:16:31.000Z,it’s leverage in every situation.,moore,0
253,2020-12-24T05:57:08.000Z,I would like to announce I will be attending the University of Alabama school for Bagmenology. I will return to Norman with a wealth of ummm knowledge. Respect my decision. No interviews. 1000% committed.,moore,0
254,2020-12-24T00:13:08.000Z,"Ok yeah I couldn’t be on The Bachelorette. I ugly cry & choke too much to show that to the world. 

I change my mind lmao",moore,0
255,2020-12-25T15:00:35.000Z,Merry Christmas yesterday I found an eWallet of mine from years ago with almost 700 dollars worth of bitcoin in it,moore,0
273,2020-12-25T00:09:10.000Z,"Tomorrow 
@HomelandStores
 @UnitedOK
 &all HAC locations will be closed to give our employee owners a day of rest.We were very fortunate to be able to issue a Thank You Bonus today as a tangible way to show gratitude for the blessing that is our wonderful&tireless employee owners",moore,0
298,2020-12-24T00:08:56.000Z,This announcement is a microcosm of the whole recruitment.,moore,0
299,2020-12-24T15:37:57.000Z,Congress is a joke and all of them should be fired and all their benefits taken away!,moore,0
300,2020-12-24T10:17:18.000Z,"Christmas 
 FaceTime starts later today and ends tomorrow. 

I’ll hug my family next year.",moore,0
301,2020-12-24T18:54:24.000Z,"AAU and college coaches, if you feel you have to tear other programs down instead of talking your program up, you have no shot at 
@RobertGambill7",moore,0
302,2020-12-25T03:49:21.000Z,Merry Christmas to all from Oklahoma!!!! To all a good night! Where are you all spending your Christmas?,moore,0
303,2020-12-24T05:19:56.000Z,y’all friends be so fine,moore,0
304,2020-12-25T19:00:01.000Z,I got the Pie out of the oven and cooling.  Now I have the AuGratin Potatoes with Bacon in the oven.,moore,0
305,2020-12-25T00:24:10.000Z,Wine and my stomach are dating,moore,0
306,2020-12-25T04:00:35.000Z,if anyone would like to have lessons on how to piss off your family; just follow me,moore,0
307,2020-12-25T18:22:56.000Z,"My husky is jumping on my son’s trampoline....

...everyone’s inside.",moore,0
308,2020-12-25T19:07:08.000Z,Merry Christmas to my real ones! Hope  y’all have a wonderful day,moore,0
309,2020-12-25T21:56:00.000Z,"Steph Curry, most over rated player of all time, losing by 50 on Christmas lmao get that trash off my screen",moore,0
329,2020-12-24T04:27:06.000Z,"Oklahoma fans before 2020 cycle: why don’t we recruit elite backs past the summer?

Oklahoma fans after 2020 cycle: i hate December",moore,0
330,2020-12-25T06:01:55.000Z,"Now that my kids are older, they asked if they should leave out milk and cookies for 
@JeffBezos
.",moore,0
331,2020-12-25T03:00:12.000Z,"“Nobody's leaving. Nobody's walking out on this fun, old-fashioned family Christmas. No, no. We're all in this together.”",moore,0
332,2020-12-25T13:21:58.000Z,if you don’t know nothing bout me know that ima go get it.,moore,0
352,2020-12-25T06:10:51.000Z,Popeyes Chicken Is The Shiznit,moore,0
353,2020-12-24T12:07:58.000Z,"This weeks episode of The Deplorables is riveting. Angry that his party will not take the Presidency from Biden, Trump is taking hostages. Millions cascading into poverty, the military and the entire government heading for shutdown. Destracting from pandemic and Russian attacks.",moore,0
354,2020-12-24T18:56:01.000Z,"Christmas Eve LINE AT THE TATTOO PARLOR. 
The amazing trend stops for no one. Not even 
 
@Uptown23rd
 ",moore,0
374,2020-12-25T20:59:17.000Z,I’m not sure who needs to hear this...but it’s ok to take that mimosa induced Christmas nap before the dinner festivities get rollin’.,moore,0
402,2020-12-24T15:59:04.000Z,Today I stepped on the scale 4 months after deciding to get healthier. My goal was to lose 15 pounds in those 4 months. I was 25.5 pounds lighter as of this morning. I’m giving myself the gift of not stepping on the scale until after the first of the year and eating what I want,moore,0
403,2020-12-25T17:47:11.000Z,"Merry Christmas to my followers who celebrate, happy holidays to everyone, may this last week of 2020 bring you rest and hope as the light comes back into the world. And happy Capricorn Season to the Goat babies. ",moore,0
404,2020-12-25T21:43:08.000Z,Vikings don’t have a chance with the Saints in the all white.,moore,0
405,2020-12-25T05:58:15.000Z,I hope Santa gives me bigger anime tiddes ,moore,0
406,2020-12-25T15:25:47.000Z,Merry Christmas! My mom just asked me why I had an attitude via text two days ago. ,moore,0
407,2020-12-24T18:50:39.000Z,Word of advice don’t go to Walmart on Christmas Eve. Pure chaos!,moore,0
408,2020-12-24T05:27:07.000Z,"Unexpected phone call from 
@SarahKassaWx
 talking about life and weather was a great way to end the night! Miss you friend!",moore,0
409,2020-12-25T16:35:32.000Z,"Merry Christmas everyone!

What crazy plans do you have today?",moore,0
410,2020-12-24T22:30:28.000Z,"I hope 
@ESPNAshley
 has the best Christmas ever. She is not only beautiful, but she’s extremely hard working.",moore,0
411,2020-12-25T04:53:03.000Z,"Trying to get some positive energy going. Tell me something GOOD that happened for you in 2020. Sports related or not, doesn’t matter. Just good news. Testify!",moore,0
0,2020-12-25T00:23:39.000Z,"As I turn 37 tomorrow, I think of how John Adams remained a footnote in history until his early 40s. I am committed to spending my career in the classroom, with no desire to become an administrator, but you ain’t seen nothing yet . #edchat #aging 
@edutopia
 @NewsHourExtra",boston,0
1,2020-12-25T02:45:19.000Z,Ordered China sky tonight and it came in 15 minutes. #Regular,boston,0
2,2020-12-25T15:13:52.000Z,"Merry Christmas to my Twitter fam!!! Whether you're 20 years clean or did 3 bags yesterday instead of your usual 4, we are all in recovery together and I believe in us all to pull through. 2020 was a wash but it is also the year I smartened up and im so grateful #recoveryposse",boston,0
3,2020-12-25T00:53:04.000Z,Keep moving forward. Do not let anything distract you from your goals. ,boston,0
4,2020-12-25T08:04:56.000Z,"The holidays are not joyous for everyone, and this year could be especially rough— even for those who typically have a good holiday season.

Take the time you need for yourself but take solace knowing others share your journey too.

Call/message your loved ones to check on them.",boston,0
5,2020-12-25T18:41:38.000Z,"Well bella hadid’s surgeon was not under my tree this year, but I’m pleased and grateful anyways ",boston,0
6,2020-12-25T18:19:03.000Z,"in 2021 let’s dead that whole “behind every man is a....” and let’s normalize “NEXT TO” because our significant others are our teammates, NOT our workers",boston,0
7,2020-12-25T12:41:29.000Z,"All I want for Christmas is adequate school ventilation, access to the vaccine, and a better plan for our kids that simulteaching.",boston,0
8,2020-12-25T19:26:12.000Z,Merry Christmas to all!,boston,0
9,2020-12-25T15:29:18.000Z,My parents had to wake us kids up this morning oh how the turn tables,boston,0
10,2020-12-25T14:44:11.000Z,"MERRY 
 CHRISTMAS 
 FRIENDS – spend today doing whatever tf you want. You deserve it.

If you’re fortunate enough to be with family, hold them extra tight this year. ",boston,0
11,2020-12-25T16:00:57.000Z,"Merry Christmas everyone. We hope everyone enjoys their time today. With love, from MTC ",boston,0
12,2020-12-25T22:57:23.000Z,My parents gave me a Christmas card -- guess what? I got $200. o.o,boston,0
13,2020-12-25T15:34:01.000Z,"my partner got me an airbrush 
 commission productivity just skyrocketed, I’m so happy",boston,0
14,2020-12-24T22:51:41.000Z,You know #COVID19 numbers are bad when adult transplant nephrologists are hanging out in the PICU.  #StayAtHome #Covid19Xmas,boston,0
15,2020-12-25T15:10:42.000Z,merry christmas to all living in the struggle we gon get thru fasho,boston,0
16,2020-12-25T14:07:55.000Z,"My new pajama pants don’t have pockets, Such a letdown",boston,0
34,2020-12-25T07:18:30.000Z,I made a lot of money this year and I know 2021 is going to be even better ,boston,0
35,2020-12-25T23:15:21.000Z,Omg I discovered I like scotch. Merry Xmas to me.,boston,0
36,2020-12-25T00:35:51.000Z,Most of us are paying a higher rate of student loan interest than investors are paying in capital gains taxes in Massachusetts. Cancel student debt and tax the wealthy,boston,0
70,2020-12-25T20:11:57.000Z,"To say KC Jones was a very nice man is a fact. To say he was tough as a player is another fact. And to say he died with more rings than anyone on the planet is another fact. He had 12: 8 as a player, 2 as a head coach and one as a Laker asst. And he had a helluva singing voice!",boston,0
71,2020-12-25T18:07:39.000Z,no sun kong tonight. sad.,boston,0
72,2020-12-25T00:11:59.000Z,Really excited to pull a soft glam look to sit in my living room all day tomorrow,boston,0
73,2020-12-25T14:11:26.000Z,Santa got me a new handheld microphone my voice will be projected for ages!!!!!!!,boston,0
74,2020-12-24T23:52:35.000Z,"Wishing everyone who celebrating a joyous and safe #Christmas 
#MerryChristmas",boston,0
