,date,contents,city,city_in_disaster
75,2020-12-25T15:11:50.000Z,"Hello friends, I love you all, Merry Christmas! 

Think about reaching out to friends who might be extra lonely today. Friends who didn't travel to be with family, friends who are hurting. Send a text, a snap, show you care. It doesn't take long to make someone's day ",boston,0
76,2020-12-25T02:25:33.000Z,"Learning how to coexist with my family during the holidays 
 smoked a joint with my dad on the porch before coming in to put together a puzzle with my mom by the tree ",boston,0
77,2020-12-25T01:35:40.000Z,50+ years into the mission and I still stress out every time I step on to and off of an escalator.,boston,0
97,2020-12-25T15:36:36.000Z,Let the day drinking begin!!!! #MerryChristmas,boston,0
98,2020-12-24T17:18:11.000Z,I don’t understand why my tax money goes to a government that prioritizes purchasing weapons of war instead of helping out struggling Americans.,boston,0
99,2020-12-25T17:15:38.000Z,Merry Christmas Twitter fam!! Much love and holiday warmth to all of you,boston,0
100,2020-12-25T17:35:01.000Z,"Overheard in the ED this morning

Resident to patient: Do you know what year it is?

Patient: Unfortunately, I think it’s still 2020.

Merry Christmas ",boston,0
120,2020-12-25T20:06:13.000Z,"Got my period on Christmas, call that Krampus",boston,0
121,2020-12-25T15:12:58.000Z,I LOVE CHRISTMAS!!!!!!!,boston,0
122,2020-12-25T15:03:49.000Z,Happy buttsmas,boston,0
123,2020-12-24T23:11:21.000Z,"Since there’s probably few people on here to see this. 

I’m definitely faster now with CDK than I am with SAM. I need to add basic SAM/CFN snippets to Vim.",boston,0
143,2020-12-24T06:27:43.000Z,"honey i’m telling y’all, cutting off toxic parents/family members is...overwhelming. you’ll be lost, low on $, feel alone. but, that’s the darkness before LIGHT. eventually you’ll find urself & grow from it & guess what? it’ll be you on a soul level & not what they wanted u 2 be.",boston,0
144,2020-12-25T15:28:49.000Z,"These days you can’t even say “Merry Christmas”, you have to say, “Yippee Ki Yay Motherfucker.”",boston,0
145,2020-12-24T19:31:49.000Z,Attention: I have obtained caviar for single girl xmas celebrations. ,boston,0
163,2020-12-25T18:25:36.000Z,Merry Christmas you #slippery animals ,boston,0
190,2020-12-24T04:14:31.000Z,"Heather, you’re doing great girl. #RHOSLC",boston,0
191,2020-12-24T15:33:14.000Z,"Growing up some of us wanted to be doctors, lawyers, ect. 

I simply aspired to be the man on the cliff in my hometown in Italy that sold lemons",boston,0
192,2020-12-24T23:37:37.000Z,“her name is fiona apple? she could be on veggietales” -my mom,boston,0
193,2020-12-25T01:14:51.000Z,Watching “A Christmas Carol” with Alistair Sims. My favorite version of the many that have been made. Also my Dad’s.,boston,0
194,2020-12-25T00:35:16.000Z,tell santa i smoked all the cookies ,boston,0
195,2020-12-25T15:06:05.000Z,Merry Christmas to all from Archbishop Williams baseball. God bless. #RollBills,boston,0
196,2020-12-24T19:40:04.000Z,Today is one of those days where I test the limits of how stoned one can get,boston,0
197,2020-12-25T21:49:49.000Z,"Merry Xmas to all of our players, parents, coaches and staff! Enjoy time with family
 My energy goes out to all our players who could not go home this year to see their fam in order to hoop. #HardWorkIsAChoice",boston,0
198,2020-12-24T23:19:08.000Z,"Merry Christmas! It may not be the Christmas experience you’re used to, and times remain scary. But make the most of it. Next year we will catch up on all the lost get togethers. Cheers all!",boston,0
199,2020-12-25T15:42:02.000Z,"If you’re mad that you got someone a gift but they didn’t get you one, then reevaluate why you are giving. If you’re giving me something with the expectation of something in return then I don’t want it",boston,0
200,2020-12-24T03:03:31.000Z,"Who else can't wait for #slippery merch!!?  And what do you want to see once it's live!!? Got some cool concepts on the way! 
#slipperysworld #slipperypete
#smashingismypassion
#highlycalculatedviolence",boston,0
220,2020-12-25T10:42:46.000Z,My brother and I used to wake up every Christmas morning and play board games till everyone else in the house woke up and it was time to open gifts.,boston,0
221,2020-12-25T14:40:17.000Z,"Today I'm hosting a liberty meet-up. We're going to order Chinese food and play boardgames. For now, I have to clean clean clean. ",boston,0
222,2020-12-25T16:42:34.000Z,Everyone is getting an air fryer for Christmas I’m dead.,boston,0
241,2020-12-25T05:19:42.000Z,"There are so many things about weather I don't understand. Like. Snowstorms in the Midwest right now, going to be rainstorms when they hit Boston tomorrow. Why does the need for precipitation transfer but not the cold temps??? Why is weather?",boston,0
242,2020-12-25T17:16:30.000Z,"One of my favorite 
@PaulistFathers
 priests has been saying “Christmas is the same this year, everything surrounding it is different.” However you find yourself today, may the peace of Christ be with you. Merry Christmas. 
@AWHSBishops
 @CSOboston",boston,0
243,2020-12-25T12:09:51.000Z,"May your Christmas sparkle with moments of love, laughter and goodwill. And may the year ahead be full of contentment and joy. Have a very Merry Christmas.",boston,0
261,2020-12-24T01:48:23.000Z,Miller highlife unblocked me on ig ,boston,0
262,2020-12-25T01:46:49.000Z,I’m in bed rubbing my feet together. It’s clipped,boston,0
263,2020-12-25T13:21:01.000Z,Merry Christmas to one and all. 2020 has been a catastrophe in so many ways but it’s brought out the best in us. Let’s kick on to 2021 and make it a cracker.,boston,0
293,2020-12-25T04:15:09.000Z,"the intro to twin peaks....

MAN....",boston,0
294,2020-12-24T12:49:17.000Z,"I failed my first coding class in college and here I am 11 years later a SWE 
@Twitter
. Never give up on your goals!

#100DaysOfCode #CodeNewbies",boston,0
295,2020-12-25T16:47:30.000Z,"Last night I said goodbye to my grandfather via video chat. I am thankful that my dad was physically with him in his final moments. I beg you all to #WearAMask
 #stayhome
 #WashYourHands
 Rest In Peace, Grandpa.",boston,0
296,2020-12-25T14:06:22.000Z,holidays were never for me,boston,0
297,2020-12-24T23:56:04.000Z,"Once I’m done celebrating the holidays and am back in the tip, I’m gonna try releasing almost everything I’ve recorded this semester and beyond. I’m tired of not exercising my creative juices and  releasing anything for the bands I’m in lol",boston,0
298,2020-12-25T23:08:03.000Z,Kyrie. What makes ya laugh makes ya cry.,boston,0
299,2020-12-25T20:51:38.000Z,"Anyone get a puppy for Christmas? If so, pictures please. Or, whatever. Just post pictures of dogs enjoying Christmas!",boston,0
300,2020-12-25T17:44:10.000Z,Yesterday was tough. Being alone has been hard. But today I woke up and I’m still standing. Just gotta be hopeful.,boston,0
301,2020-12-25T13:16:37.000Z,"Merry Christmas to all the grown up babies of disappointing Christmases past. I hope you’ve found a way to make it happy in your own way, even if that means staying in bed all day.",boston,0
320,2020-12-25T15:11:07.000Z,Merry Christmas and a Happy Green New Deal to all of you ,boston,0
321,2020-12-24T23:44:27.000Z,IDC what Demons you got. Just show me you can handle em.,boston,0
322,2020-12-25T15:50:51.000Z,"Merry Christmas to me, an old dad apparently. I just got a Facebook ad that says: ""Being a dad doesn't have to mean having a dad's hairline.""",boston,0
323,2020-12-25T16:55:06.000Z,"Day 1 post-vaccine. I can feel my five (six?) senses growing steadily sharper, but have lost any and all recollection of who Kirk...Cameron(?) is. 

Fine with it.",boston,0
343,2020-12-24T19:45:55.000Z,"To top off this dumpster fire of a year, I have one freshly broken ankle! I’m predicting some creative problem solving in my future...",boston,0
344,2020-12-25T20:20:31.000Z,"Correcting myself. KC. Jones had 12. Rings: 8 as a player, 2 as a Celtics head, one as a Celtic assistant and one as a Laker assistant. I omitted the ‘’81 Celtics assistant ring in my original annotation.",boston,0
345,2020-12-25T18:06:01.000Z,"Asking you to take a moment to toss up a #Christmas day prayer for a young couple whose infant daughter, Francesca,, passed away last night.",boston,0
346,2020-12-25T00:12:25.000Z,really out here drinking baileys,boston,0
366,2020-12-24T15:25:48.000Z,someone get me a jayson tatum jersey for xmas,boston,0
367,2020-12-25T19:56:58.000Z,"Sad to hear about K.C. Jones. He was a great champion on the early Celtics dynasty and coached 2 of my favorite title teams in 84 and 86. He wasn't the greatest X and O guy but Bird, McHale, Chief and the others  loved playing for him and would run through a wall for him. RIP.",boston,0
368,2020-12-24T19:16:01.000Z,PSA: if you can’t pre-slice a bagel evenly please don’t try to pre-slice it at all. Thank you.,boston,0
401,2020-12-24T18:12:39.000Z,Nothing makes me mad faster than when someone says med school/law school loans shouldn’t be forgiven or those shouldn’t be free. yeah it’s a great idea to class-limit (check notes) who decides who lives or dies,boston,0
402,2020-12-25T13:01:35.000Z,Mother Nature going out of its way to take away what would have been a white Christmas is just peak 2020.,boston,0
403,2020-12-24T03:49:29.000Z,"“If it’s there, I’m going to take it.” - Giannis Antetokounmpo on his outside shot, which helped the #Bucks get back into the game. He & his teammates have seen thousands go in, so he - and they - are ready for those opportunities.",boston,0
404,2020-12-25T03:10:02.000Z,"For Christmas, our HOA of 3 condos - cooked a few dishes for each other, so we could all have diverse and delicious Christmas meal tomorrow in our own little bubble. grateful for thoughtful and caring neighbors.",boston,0
405,2020-12-25T23:05:43.000Z,Made it two whole minutes into Soul before I was crying. Fucking Disney.,boston,0
406,2020-12-25T17:13:08.000Z,i say “he knows where home is” but the difference between me & a pick me is that a pick me will twiddle her thumbs waiting for him to come home. i’ll let him come home but someone else was in my guts while u did what u wanted to do.we all got that one special nigga let’s be real.,boston,0
407,2020-12-25T17:59:21.000Z,when is it too early to start drinking the coquito a sweet neighbor brought on Xmas eve?  asking for a friend.,boston,0
408,2020-12-25T23:29:19.000Z,"Somebody buy one more art piece and get me above 
@LuxExpression
 in daily sales 
 MERRRRY CHRISTMAS!
app.rarible com/fastaction",boston,0
0,2020-12-25T20:53:28.000Z,All the couples in my TL celebrating Christmas together in matching pjs >> ,nyc,0
1,2020-12-25T23:21:14.000Z,This Christmas... not a fan.,nyc,0
2,2020-12-25T19:57:33.000Z,Lol The bar is so low right now for music you can literally take a step over it,nyc,0
3,2020-12-25T22:32:48.000Z,I’m an incredible cook and one day I’m going to make an incredible wife,nyc,0
4,2020-12-25T18:52:46.000Z,It’s the sorrel slander... it’s either it ain’t being made right or yall taste buds childish,nyc,0
5,2020-12-25T22:12:57.000Z,Be the reason someone smiles today.,nyc,0
6,2020-12-25T19:40:33.000Z,Great Blue Heron by 59th street pond #birdcp,nyc,0
7,2020-12-25T19:08:29.000Z,Happy Holidays To those in heaven who didn’t make it to see today. You’re missed and will never be forgotten ,nyc,0
8,2020-12-25T22:56:37.000Z,Leave carti tf alone,nyc,0
9,2020-12-25T20:26:45.000Z,"Merry Christmas to everyone 
 except for the women who dig their nails into your back when you aren’t even really beating it up like that y’all are trash",nyc,0
10,2020-12-25T19:50:15.000Z,Some of you are mad materialistic for no reason youre still a joke ,nyc,0
11,2020-12-25T21:11:49.000Z,ALONE TIME IS ALWAYS NEEDED I DONT NEED TO EXPLAIN THAT!,nyc,0
12,2020-12-25T17:43:44.000Z,"Been a fan of Christopher Nolan forever. 
@TENETFilm
 is one of his best. Watch it for his brilliance & awesome #DimpleKapadia ",nyc,0
13,2020-12-25T18:50:59.000Z,My timeline is looking more like Valentines Day than Christmas.,nyc,0
14,2020-12-25T19:56:12.000Z,"I’m white, but not spreads covid to dozens of other numbskull millennials because I selfishly decided to go to an ugly sweater party white",nyc,0
15,2020-12-25T23:17:35.000Z,congrats to capitalism and christians today ,nyc,0
16,2020-12-25T19:44:15.000Z,can’t wait for the existential dread to kick in when the sun sets at 4:30pm on christmas ,nyc,0
17,2020-12-25T18:26:30.000Z,my homie’s exes better watch out i’m  NOT afraid to catch a case i repeat i am not afraid,nyc,0
18,2020-12-25T20:16:58.000Z,Don’t be mean to me I will literally cry,nyc,0
19,2020-12-25T22:07:43.000Z,Jersey City artists politics are extremely corny .,nyc,0
57,2020-12-25T20:12:02.000Z,"walked into my moms crib , handed out bands 
 santa claus fanum ",nyc,0
58,2020-12-25T23:25:15.000Z,Why are there no Jews in Whoville? Don’t they pay taxes? #Grinch,nyc,0
59,2020-12-25T19:55:41.000Z,Playing PS5 in a whole other state while your baby moms is givin birth is type beast I can’t front lol,nyc,0
60,2020-12-25T21:35:21.000Z,"#SoulMovie keeps Pixar’s streak of “making parents openly weep during a cartoon” alive. 

It’s more in line with INSIDE OUT than ONWARD or COCO. Might be tough to hold little kids attention, but it’s quite beautiful.",nyc,0
61,2020-12-25T21:26:09.000Z,Ok so is Draymond still going to turn this team into a 6th seed??,nyc,0
62,2020-12-25T23:08:12.000Z,The Chinese restaurant next to my apartment is CLOSED??¿???)”¿¿?,nyc,0
63,2020-12-25T20:51:06.000Z,Merry Christmas ONLY to the cousins who don’t get invited to the family Christmas ,nyc,0
64,2020-12-25T23:28:00.000Z,my gen z roommates (who i love) havent seen gossip girl or the oc but we just watched the season 1 of the oc chrismukkah episode,nyc,0
86,2020-12-25T23:22:16.000Z,my favorite part of this game is the Kirk is frustrated montages,nyc,0
87,2020-12-25T22:28:22.000Z,Having a #JewishChristmas with Grandma Helen. Eating Chinese food and watching Christmas movies.,nyc,0
88,2020-12-25T23:12:38.000Z,i just want to look like a Tim Burton character is that too much to ask???,nyc,0
89,2020-12-25T23:52:37.000Z,First year spending Christmas alone and it’s honestly not half bad.,nyc,0
90,2020-12-25T21:39:30.000Z,The couple arguing in front of Yankee Stadium from the first episode of How to with John Wilson >>>>>>>,nyc,0
112,2020-12-25T21:27:29.000Z,So happy this year is coming to an end. Such an emotionally draining year.,nyc,0
113,2020-12-25T22:09:36.000Z,I’m honestly just thankful me & all my loved ones made it to see the end of this year ! Like all jokes aside that means the world to me !,nyc,0
114,2020-12-25T23:10:58.000Z,look at amir bilal man so inspiration,nyc,0
115,2020-12-25T19:28:05.000Z,This deadass might be the worst Christmas ever I’m dead over it,nyc,0
116,2020-12-25T22:52:28.000Z,So theyre going to make me hate the Pritchard homie huh?,nyc,0
139,2020-12-25T18:24:11.000Z,ADHD really ranges from “incapable of doing anything because my focus changes every minute” to “I AM A SUPERHUMAN WHO CAN DO TEN THINGS AT ONCE WATCH ME FLY”,nyc,0
140,2020-12-25T21:30:28.000Z,Merry Christmas everyone! ,nyc,0
175,2020-12-25T22:10:11.000Z,I threaded the needle on such an elite nap from 3:50pm-4:50pm. All I missed was the Warrior getting smacked and the back up appetizers,nyc,0
176,2020-12-25T20:29:42.000Z,the most unbelievable part of home alone 2 is that central park and rockefeller center are empty the night of christmas eve,nyc,0
177,2020-12-25T23:02:30.000Z,bf who goes to a different school,nyc,0
178,2020-12-25T21:08:32.000Z,"I’d like to forever be known as the “Italian Christmas DonkeyPunch”

Thank you and goodnight.",nyc,0
179,2020-12-25T22:50:27.000Z,"Well, someone’s drunk again. ",nyc,0
180,2020-12-25T22:08:17.000Z,First christmas without family kinda sucked ngl. Never thought I would feel that way,nyc,0
181,2020-12-25T21:16:28.000Z,Shocked on my Christmas Zoom to see mom has gone from pixie cut to pony tail since I last saw her. She looks lovely. Her hair hasn’t been long since the 1970s. For real.,nyc,0
182,2020-12-25T22:28:45.000Z,"The arguments for Covid restrictions on immune people are totally unconvincing

They rely on unlikely, unproven, remote possibilities and never take anything but Covid into account",nyc,0
183,2020-12-25T20:26:01.000Z,"I could think of worse ways of spending Christmas then here at work with a boss that makes life absolutely miserable. 

Wait....no....I can't.",nyc,0
204,2020-12-25T21:28:59.000Z,I just spent $140 on Chinese food,nyc,0
205,2020-12-25T20:08:04.000Z,"A big thank you to everyone working #ChristmasDay.

Too many people are out of work  worrying about being evicted or having to pay bills. We need to continue to fight for $15/hr #minimumwage, workers rights, unemployment benefits, hazard pay & a lot more.",nyc,0
206,2020-12-25T21:07:29.000Z,Always trust that gut feeling!,nyc,0
207,2020-12-25T23:27:03.000Z,help i’m smitten over a guy and my usual depressing music isn’t hitting like it usually does am i happy???,nyc,0
227,2020-12-25T23:55:44.000Z,I am in no hurry to prove anything to anyone. I’m steady enjoying my journey. You should be too ,nyc,0
228,2020-12-25T20:30:11.000Z,So y'all really out here embezzling non profit money and spending it on the trade...,nyc,0
229,2020-12-25T19:50:24.000Z,"Damn lmao. I'm really never gonna get the "" matching Christmas pjs "" headass moment ",nyc,0
230,2020-12-25T23:42:05.000Z,"The way WW84 didn’t end with Wonder Woman singing ""Imagine""

Missed opportunity, really",nyc,0
249,2020-12-25T23:26:56.000Z,"Going to be annoying having to hear people pat themselves on the back for WEEKS after we get into the new year lol. Weeks and weeks of, “We made it !...it’s been a difficult time for all of us but we made it!”",nyc,0
250,2020-12-25T23:59:19.000Z,Nets need one more quarter. Gotta stay engaged.,nyc,0
251,2020-12-25T20:31:56.000Z,Tinder please stop telling me if I liked a “super popular” user,nyc,0
283,2020-12-25T19:30:37.000Z,Merry Christmas I love you but I don’t have the energy to text you all individually xo,nyc,0
284,2020-12-25T20:10:34.000Z,Eating onion dip on all fours,nyc,0
285,2020-12-25T20:13:45.000Z,wait wrist icicle ride dick bicycle are the ACTUAL lyrics ?? I thought we were just saying that as a joke ,nyc,0
286,2020-12-25T20:37:49.000Z,keep the christmas engagements and baby reveals coming! ,nyc,0
287,2020-12-25T20:33:46.000Z,"In the part of China I grew up, the Christmas tradition was to go to expensive seafood buffet with a raffle. I never figured out why, but perhaps because Christmas is the only holiday people could enjoy themselves without social/family/tradition pressures.",nyc,0
288,2020-12-25T18:45:10.000Z,I need volunteers from people who know my phone number to be my representatives if the Baldwins get me kicked off Twitter,nyc,0
289,2020-12-25T18:58:47.000Z,"I thought it was so dumb that everyone was ""surprised"" that Kevin McAlister's dad was rich because that's the PREMISE of the original movie The Wet bandits KNOW the family is rich.

That's why they trying to rob em.

Burberry hooded camel.
Money honey.",nyc,0
290,2020-12-25T23:57:53.000Z,Woke up this morning and got some gabagool,nyc,0
291,2020-12-25T23:21:51.000Z,The Sopranos except it takes place in 1950s USSR.,nyc,0
311,2020-12-25T21:46:56.000Z,"The new movie, #WonderWoman1984, is exceptional. Best DC film in a very long time.",nyc,0
312,2020-12-25T22:40:15.000Z,"#JingleJangle is an absolute delight!! Great Xmas viewing!!

More Black children having whimsical adventures please.",nyc,0
313,2020-12-25T23:37:41.000Z,"I’m reminded today the holidays are difficult when you have family members who are severely brainwashed w/Trump/FOX propaganda. It can’t be ignored that 70+mil ppl voted for a conman, painful when it’s a family member. Politics are not just politics. They reflect your values.",nyc,0
332,2020-12-25T20:40:04.000Z,Merry Christmas to all my guys out there. You know who you are. See you Wednesday’s at 8 starting soon!! LFG!!!,nyc,0
333,2020-12-25T21:25:54.000Z,"Yeah, I’m going to need this pandemic to wrap up. I’ve gotten too many cute things that need to be shown off in the real world.",nyc,0
334,2020-12-25T18:47:12.000Z,"Watching 
@MSU_Basketball
 play Wisconsin and can’t help but think they did it right by wearing green and red jerseys today 
Also Go Green baby (cc: 
@CaraLKaye
)",nyc,0
335,2020-12-25T21:07:28.000Z,"Ok folks. Spouse and I are taking the plunge and trying Destiny 2 tonight for the first time ever. Any, uh, tips?",nyc,0
355,2020-12-25T22:52:41.000Z,I wanna handcuff my man & suck his dick until he’s crying ,nyc,0
356,2020-12-25T21:50:55.000Z,"It’s crazy because there is so much pressure on 2021 to be a better year than 2020. So many expectations, hope, dreams.",nyc,0
357,2020-12-25T22:24:24.000Z,I have reached the phase of life where my friends are sufficiently accomplished that promoted tweets containing movie trailers occasionally confront me with the face of someone I know socially and/or have slept with. It’s really quite amusing and/or disconcerting.,nyc,0
358,2020-12-25T22:05:52.000Z,evermore > folklore > 1989 > reputation > Speak Now > Red > Lover > Fearless > self-titled,nyc,0
402,2020-12-25T18:52:30.000Z,Remember that time a few days ago when my husband asked me to get a 2-3 pound ham and I came home with an 8 pound ham for two of us?  No? Thst is fine. He is just finding out about that as well.,nyc,0
403,2020-12-25T18:49:53.000Z,Honestly it’s kind of crazy to think that we used to get CDs for Christmas.,nyc,0
404,2020-12-25T23:24:52.000Z," Financial freedom comes from taking 3 simple steps

1. Buying a website (finding an opportunity that others don’t see)

2. Improving the website (creating a ton of value by working hard on that opportunity)

3. Flipping the website (finding someone to pay for your work)",nyc,0
405,2020-12-25T21:50:19.000Z,"Celebrate love, peace & happiness. Be grateful for even the smallest things. Material things will never compensate for love. 
Take a moment to be grateful you are still alive while millions of people who have died from COVID_19 are not here to celebrate with their families. ",nyc,0
406,2020-12-25T23:31:05.000Z,I can’t be the only one who missed the pajama memo,nyc,0
407,2020-12-25T18:00:45.000Z,Not my mom calling me an alcoholic after drinking two glasses of wine... and not her telling me her relatives died of drinking ,nyc,0
408,2020-12-25T23:03:57.000Z,Those deep 3s from Kyrie are so debilitating,nyc,0
409,2020-12-25T21:49:07.000Z,I’m boutta get a crab boil bag & imagine what it taste like lmaoooo,nyc,0
410,2020-12-25T23:42:58.000Z,If you're a Knicks fan and still telling yourself you're glad KD and Kyrie went to BK instead of the Knicks you really need to stop.,nyc,0
411,2020-12-25T23:30:49.000Z,"A Christmas story is legit the only movie I can watch over and over and over and never get tired. It’s been my Christmas tradition since I was 7, I love this marathon. #ChristmasStory #shootyoureyeout",nyc,0
412,2020-12-25T23:38:21.000Z,"Just found out my grandmother is scheduled to get the vaccine around Jan. 17, so there’s a nice present to end the day.",nyc,0
431,2020-12-25T19:50:08.000Z,I have to say this on Twitter cuz my family dont follow me here but just found out my closeted mysoginist femme-phobic gay uncle is in a shelter and despite the descriptors i used i am so sad about it. Its xmas day and im like wow my family dont give a shit,nyc,0
432,2020-12-25T20:00:17.000Z,"Black people (and other POC):

What we drinking today? 
Also, what we 
 today? Tell me about those edibles. 
What time does Uno start, and when do we switch to Spades?",nyc,0
433,2020-12-25T18:14:16.000Z,Planning a snow trip just ran me about $1000+ ice water will be the only thing on the menu for the next 2 weeks. Y’all be safe ,nyc,0
0,2020-12-25T02:59:29.000Z,Rolling with the Dolphins! Watch #MIAvsLV SATURDAY at 8:15pm ET on NFL Network!,joplin,0
1,2020-12-24T14:21:13.000Z,when show choir is done my hair will be purple,joplin,0
2,2020-12-25T21:28:42.000Z,"The first 3/4 of #WonderWoman1984 are a lot of fun and overall pretty solid. But wow those last 20 mins are ROUGH.

I think I liked it more than WW but it has the same problem of the final fight just being so extremely meh.",joplin,0
3,2020-12-25T15:13:25.000Z,All I want for Christmas is my favorite resident to be working in ED today,joplin,0
4,2020-12-24T13:53:49.000Z,I love my job. The owner of the company came in early himself and made everyone biscuits and gravy just because...Merry Christmas Eve!,joplin,0
5,2020-12-25T05:29:07.000Z,I can’t wait till Kyrie is old enough to do the whole Santa thing and set milk and cookies out for him and start our own traditions!! ,joplin,0
6,2020-12-24T06:37:12.000Z,One day my heart will be completely healed.,joplin,0
7,2020-12-25T05:38:43.000Z,We really got Uzi projects and a Carti project ,joplin,0
8,2020-12-24T15:48:32.000Z,I miss Ben Brest already :(,joplin,0
9,2020-12-25T15:17:13.000Z,It’s just not feeling very Christmasy this year.,joplin,0
10,2020-12-24T14:03:38.000Z,"I can’t smell or taste anything, I can’t breathe, I can’t get up without getting dizzy, my throat and head hurt so bad. Austin is so achy I can barely touch him. Covid is actually the worst.",joplin,0
11,2020-12-25T14:36:35.000Z,Merry Christmas! Have a great day everyone ,joplin,0
